clave,descr,unidad,PA
010.000.4442.00,Aprepitant. C치psula Cada C치psula contiene: 125 mg de Aprepitant Cada C치psula contiene: 80 mg de Aprepitant Envase con una C치psula de 125 mg y 2 C치psulas de ,Pieza,Aprepitant
010.000.4444.00,Dexrazoxano. Soluci칩n Inyectable. El frasco 치mpula contiene: Clorhidrato de dexrazoxano equivalente a 500 mg de dexrazoxano. Envase con un frasco 치mpu,Pieza,Dexrazoxano
010.000.4448.00,Bortezomib. Soluci칩n Inyectable Cada frasco 치mpula con liofilizado contiene: Bortezomib 3.5 mg Envase con un frasco 치mpu,Pieza,Bortezomib
010.000.4485.00,Duloxetina. C치psula de liberaci칩n retardada. Cada c치psula de liberaci칩n retardada contiene: Clorhidrato de duloxetina equivalente a 60 mg de duloxetina Envase con 14 C치psulas de Liberaci칩n Reta,Pieza,Duloxetina
010.000.4487.00,Reboxetina. Tableta Cada Tableta contiene Metansulfonato de reboxetina equivalente a 4 mg de reboxetina Envase con 60 Tabletas.,Pieza,Reboxetina
010.000.4488.00,Venlafaxina. C치psula o Gragea de Liberaci칩n Prolongada Cada C치psula o Gragea de Liberaci칩n Prolongada contiene: Clorhidrato de venlafaxina equivalente a 75 mg de venlafaxina. Envase con 10 C치psulas o Grageas de Liberaci칩n Prolo,Pieza,Venlafaxina
010.000.4503.00,Aurotiomalato s칩dico. Soluci칩n Inyectable Cada ampolleta contiene: Tiomalato de Sodio y oro 50 mg Envase con una ampolleta con un m,Pieza,Aurotiomalato sodico
010.000.4504.00,Sulfasalazina. Tableta CoN Capa Ent칠rica Cada Tableta con Capa Ent칠rica contiene: Sulfasalazina 500 mg Envase con 60 Tabletas con Capa Ent칠ri,Pieza,Sulfasalazina
010.000.4508.00,Infliximab. Soluci칩n Inyectable El frasco 치mpula con liofilizado contiene: Infliximab 100 mg Envase con un frasco 치mpula con liofilizado e instructi,Pieza,Infliximab
010.000.4527.00,Linestrenol. Tableta. Cada tableta contiene: Linestrenol 0.50 mg. Envase con 28 tabletas.,Pieza,Linestrenol
010.000.4590.00,Tigeciclina. Soluci칩n Inyectable Cada frasco 치mpula con liofilizado contiene: Tigeciclina 50 mg Envase con un frasco 치mpu,Pieza,Tigeciclina
010.000.4592.00,Piperacilina-tazobactam. Soluci칩n Inyectable Cada frasco 치mpula con polvo contiene: Piperacilina s칩dica equivalente a 4 g de piperacilina. Tazobactam s칩dico equivalente a 500 mg de tazobactam. Envase con frasco 치m,Pieza,Piperacilina-tazobactam
010.000.5079.00,Cloropiramina. Soluci칩n Inyectable. Cada ampolleta contiene: Clorhidrato de cloropiramina 20 mg Envase con 5 ampolletas con 2 ml,Pieza,Cloropiramina
010.000.5099.00,Adenosina. Soluci칩n Inyectable Cada frasco 치mpula contiene: Adenosina 6 mg Envase con 6 frascos 치mpula con 2 ,Pieza,Adenosina
010.000.5107.00,Alteplasa. Soluci칩n Inyectable Cada frasco 치mpula con liofilizado contiene: alteplasa (activador tisular del plasmin칩geno humano) 50 mg Envase con 2 frascos 치mpula con liofilizado 2 frascos 치mpula con disolvente y equipo esterilizado para su reconstitu,Pieza,Alteplasa
010.000.5111.00,Valsart치n. Comprimido Cada Comprimido contiene 80 mg Envase con 30 Comprimidos,Pieza,Valsartan
010.000.5117.00,Tenecteplasa. Soluci칩n Inyectable Cada frasco 치mpula contiene: Tenecteplasa 50 mg (10000 U) Envase con frasco 치mpula y jeringa prellenada con 10 ml de agua Inyectab,Pieza,Tenecteplasa
010.000.5126.00,Metoxaleno. C치psula o Tableta Cada C치psula o Tableta contiene: Metoxaleno 10 mg Envase con 30 C치psulas o Tablet,Pieza,Metoxaleno
010.000.5130.00,Antralina. Ung칲ento Cada g contiene: Antralina 20 mg Envase con 50 g,Pieza,Antralina
010.000.5166.00,Acarbosa. Tableta Cada Tableta contiene: Acarbosa 50 mg Envase con 30 Tabletas.,Pieza,Acarbosa
010.000.5172.00,Somatostatina. Soluci칩n Inyectable Cada ampolleta con liofilizado contiene: Acetato de somatostatina equivalente a 3.0 mg de somatostatina. Envase con una ampolleta,Pieza,Somatostatina
010.000.5176.00,Sucralfato. Tableta Cada Tableta contiene: Sucralfato 1 g Envase con 40 Tabletas.,Pieza,Sucralfato
010.000.5187.00,Omeprazol o pantoprazol. Soluci칩n Inyectable Cada frasco 치mpula con liofilizado contiene: omeprazol s칩dico equivalente a 40 mg de omeprazol. o pantoprazol s칩dico equivalente a 40 mg de pantoprazol. Envase con un frasco 치mpula con liofilizado y ampolleta con 10 ml de diluy,Pieza,Omeprazol o pantoprazol
010.000.5204.00,Urofolitropina. Soluci칩n Inyectable Cada frasco 치mpula con liofilizado contiene: Urofolitropina 75 UI Envase con un frasco 치mpula y diluyente con 1 ,Pieza,Urofolitropina
010.000.5232.00,Piridoxina. Tableta. Cada tableta contiene: Piridoxina 300 mg Envase con 10 Tabletas.,Pieza,Piridoxina
010.000.5238.00,Factor ix. Soluci칩n Inyectable Cada frasco 치mpula con liofilizado contiene: Factor IX 400 a 600 UI Envase con un frasco 치mpula y diluyen,Pieza,Factor ix
010.000.5239.00,Anticuerpos monoclonales cd3. Soluci칩n Inyectable Cada ampolleta o frasco 치mpula contiene: Anticuerpos monoclonales CD3 5 mg Envase con 5 ampolletas o frascos 치mpu,Pieza,Anticuerpos monoclonales cd3
010.000.5246.00,Aprotinina. Soluci칩n Inyectable Cada ml contiene: Aprotinina 10 000 UIK Envase con frasco 치mpula con 50 ml (500 000 UIK,Pieza,Aprotinina
010.000.5255.00,Trimetoprima y sulfametoxazol. Soluci칩n Inyectable Cada ampolleta contiene: Trimetoprima 160 mg Sulfametoxazol 800 mg Envase con 6 ampolletas con 3 ml,Pieza,Trimetoprima y sulfametoxazol
010.000.5256.00,Cefalotina. Soluci칩n Inyectable. Cada frasco 치mpula con polvo contiene: Cefalotina s칩dica equivalente a 1 g de cefalotina. Envase con un frasco 치mpula y 5 ml de diluye,Pieza,Cefalotina
010.000.5257.00,Natalizumab. Soluci칩n Inyectable Cada frasco 치mpula contiene: Natalizumab 300 mg Envase con frasco 치mpula con 300 ,Pieza,Natalizumab
010.000.5261.00,Pirimetamina. Tableta Cada Tableta contiene: Pirimetamina 25 mg Envase con 30 Tabletas.,Pieza,Pirimetamina
010.000.5268.00,Ganciclovir. Soluci칩n Inyectable. Cada frasco 치mpula con liofilizado contiene: Ganciclovir s칩dico equivalente a 500 mg de ganciclovir. Envase con un frasco 치mpula y una ampolleta con 10 ml de diluye,Pieza,Ganciclovir
010.000.5290.00,Saquinavir. Comprimido Cada Comprimido contiene: Mesilato de saquinavir equivalente a 500 mg de saquinavir Envase con 120 Comprimidos,Pieza,Saquinavir
010.000.5304.00,Alfa cetoan치logos de amino치cidos. Gragea Tableta Recubierta o Tableta. Cada Gragea tableta recubierta o tableta contiene: Alfa cetoan치logos de Amino치cidos 630 mg Envase con 100 grageas tabletas recubiertas o table,Pieza,Alfa cetoanalogos de aminoacidos
010.000.5307.00,Plerixafor. Soluci칩n Inyectable Cada frasco 치mpula contiene: Plerixafor 24 mg Envase con frasco 치mpula con 24 mg/1.2 ml (20 mg/m,Pieza,Plerixafor
010.000.5312.00,Quinupristina-dalfopristina. Soluci칩n Inyectable El frasco 치mpula con liofilizado contiene: Quinupristina 150 mg Dalfopristina 350 mg Envase con frasco 치mpu,Pieza,Quinupristina-dalfopristina
010.000.5328.00,Pentamidina. Soluci칩n Inyectable Cada frasco 치mpula con liofilizado contiene: Isetionato de pentamidina 300 mg Envase con un frasco 치mpu,Pieza,Pentamidina
010.000.5330.00,Alfa-dornasa. Soluci칩n Para Inhalaci칩n Cada ampolleta contiene: alfa-dornasa 2.5 mg Envase con 6 ampolletas de 2.5 m,Pieza,Alfa-dornasa
010.000.5331.00,Beractant. Suspensi칩n Inyectable Cada ml contiene: Beractant (fosfol칤pidos de pulm칩n de origen bovino) 25 mg Envase con frasco 치mpula de 8 ml con o sin c치nula endotraq,Pieza,Beractant
010.000.5352.00,Cloral. Jarabe. Cada 5 ml contienen: Hidrato de cloral 500 mg Envase 120 ml.,Pieza,Cloral
010.000.5353.00,Flunarizina. C치psula o Tableta Cada C치psula o Tableta contiene: Flunarizina 5 mg Envase con 20 C치psulas o Tablet,Pieza,Flunarizina
010.000.5354.00,Nimodipino. Soluci칩n Inyectable Cada frasco 치mpula contiene: Nimodipino 10 mg Envase con 1 frasco 치mpula con 50 ml con o sin equipo perfusor de polietile,Pieza,Nimodipino
010.000.5355.00,Vigabatrina. Comprimido Cada Comprimido contiene: Vigabatrina 500 mg Envase con 60 Comprimidos.,Pieza,Vigabatrina
010.000.5378.00,Manganeso. Soluci칩n Inyectable  Cada ampolleta contiene: Manganeso 924 췃g. Envase con 25 ampolletas de 3 m,Pieza,Manganeso
010.000.5379.00,Zinc. Soluci칩n Inyectable Cada ampolleta contiene: Sulfato de zinc heptahidratado Equivalente a 5 mg de zinc elemental. Envase con 25 ampolletas de 3 ml,Pieza,Zinc
010.000.5381.00,Oligometales endovenosos. Soluci칩n Inyectable Cada 100 ml. Contienen: Cloruro de Zinc 55.0 mg Sulfato c칰prico pentahidratado 16.9 mg Sulfato de manganeso 38.10 mg Yoduro de sodio 1.30 mg Fluoruro de sodio 14.0 mg Cloruro de sodio 163.9 mg Cada frasco 치mpula proporciona en electrolitos: Zinc 0.1614 mEq Cobre 0.0271 mEq Manganeso 0.0902 mEq Sodio 4.5493 mEq Sulfato 0.1172 mEq Yodo 0.0017 mEq Fl칰or 0.0666 mEq Cloro 0.7223 mEq Envase con 10 frascos 치mpula de 2,Pieza,Oligometales endovenosos
010.000.5391.00,Dieta Polimerica Sin Fibra. Suspension Oral O Enteral. Cada 100ml Contiene:    Prote칤nas Unidad g M칤nimo 3.6 M치ximo 4 L칤pidos Unidad g M칤nimo 3.4 M치ximo 3.92 Hidratos de carbono Unidad g M칤nimo 12.72 M치ximo 13.8 Vitamina A Unidad U.I. M칤nimo 264.2 M치ximo 400 Vitamina D Unidad U.I. M칤nimo 21.1 M치ximo 28 Vitamina E Unidad U.I. M칤nimo 2.4 M치ximo 3.33 Vitamina K1 Unidad  췃g M칤nimo 4.2 M치ximo 8 Vitamina C Unidad mg M칤nimo 9.7 M치ximo 15.9 Tiamina B1 Unidad mg M칤nimo 0.16 M치ximo 0.2 Riboflabina B2 Unidad mg M칤nimo 0.18 M치ximo 0.24 Niacina Unidad mg M칤nimo 2.11 M치ximo 2.8 Vitamina B6 Unidad mg M칤nimo 0.21 M치ximo 0.4 Acido f칩lico Unidad  췃g M칤nimo 42.3 M치ximo 54 Acido pantot칠nico Unidad mg M칤nimo 1.06 M치ximo 1.4 Vitamina B12 Unidad  췃g M칤nimo 0.63 M치ximo 0.8 Biotina Unidad  췃g M칤nimo 31.7 M치ximo 40 Colina Unidad mg M칤nimo 31.3 M치ximo 45.2 Calcio Unidad mg M칤nimo 49.4 M치ximo 75.4 F칩sforo Unidad mg M칤nimo 49.4 M치ximo 66 Magnesio Unidad mg M칤nimo 19.8 M치ximo 37.7 Zinc Unidnimo 0.89 M치ximo 1.13 Manganeso Unidad mg M칤nimo 0.15 M치ximo 0.26 Iodo Unidad  췃g M칤nimo 7 M치ximo 9.4 Sodio Unidad mg M칤nimo 47 M치ximo 79 Potasio Unidad mg M칤nimo 118 M치ximo 162 Cloruro Unidad mg M칤nimo 93.5 M치ximo 134 Cromo Unidad  췃g M칤nimo 3.77 M치ximo 5.1 Molibdeno Unidad  췃g M칤nimo 7.5 M치ximo 12.2 Selenio Unidad  췃g M칤nimo 3.77 M치ximo 5.1 Cobre Unidad mg M칤nimo 0.09 M치ximo 0.16 E,Pieza,Dieta polimerica sin fibra
010.000.5392.00,Dieta Polimerica Con Fibra. Suspension Oral O Enteral Cada 100ml Contiene:   Prote칤nas Unidad g M칤nimo 3.69 M치ximo 3.74 L칤pidos Unidad g M칤nimo 3.45 M치ximo 3.56 Hidratos de carbono Unidad g M칤nimo 11.90 M치ximo 15 Fibra dietaria total Unidad g M칤nimo 1.25 M치ximo 1.35 Vitamina A Unidad Unidad UI M칤nimo 359.3 M치ximo 400 Vitamina D Unidad UI M칤nimo 20.0 M치ximo 28.7 Vitamina E Unidad UI M칤nimo 2.8 M치ximo 3.3 Vitamina K1 Unidad 췃g M칤nimo 5.9 M치ximo 8 Vitamina C Unidad mg M칤nimo 14.0 M치ximo 21.6 Tiamina B1 Unidad mg M칤nimo 0.16 M치ximo 0.2 Riboflabina B2 Unidad mg M칤nimo 0.19 M치ximo 0.24 Niacina Unidad mg M칤nimo 2.16 M치ximo 2.8 Vitamina B6 Unidad mg M칤nimo 0.21 Acido f칩lico Unidad  췃g M칤nimo 43.1 M치ximo 54 Acido pantot칠nico Unidad mg M칤nimo 1.0 M치ximo 1.4 Vitamina B12 Unidad  췃g M칤nimo 0.68 M치ximo 0.8 Biotina Unidad  췃g M칤nimo 32.5 M치ximo 40 Colina Unidad mg M칤nimo 43.1 M치ximo 45.2 Calcio Unidad mg M칤nimo 65.5 M치ximo 66 F칩sforo Unidad mg M칤nimo 65.5 M치ximo 66 Magnesio Unimo 1.3 M치ximo 1.5 Hierro Unidad mg M칤nimo 1.1 M치ximo 1.2 Manganeso Unidad mg M칤nimo 0.25 M치ximo 0.34 Iodo Unidad  췃g M칤nimo 9 M치ximo 10 Sodio Unidad mg M칤nimo 46.78 M치ximo 70.5 Potasio Unidad mg M칤nimo 117.1 M치ximo 157 Cloruro Unidad mg M칤nimo 93.5 M치ximo 126 Cromo Unidad  췃g M칤nimo 3.74 M치ximo 6.7 Molibdeno Unidad  췃g M칤nimo 10.2 M치ximo 11.2 Selenio Unidad  췃g M칤nimo 3.74 M치ximo 4.7 Cobre Unidad mg M칤nimo 0.13 M치ximo 0.14,Pieza,Dieta polimerica con fibra
010.000.5393.00,Aminoacidos enriquecidos con aminoacidos de cadena ramificada. Soluci칩n inyectable. Cada 100ml Contiene: L- Isoleucina Unidad mg M칤nimo 700 M치ximo 1380. L- Leucina Unidad mg M칤nimo 1100 M치ximo 1580. L- Lisina Unidad mg M칤nimo 265 M치ximo 690 L- Metionina Unidad mg M칤nimo 110 M치ximo 450 L- Fenilalanina Unidad mg M칤nimo 80 M치ximo 480 L- Treonina Unidad mg M칤nimo 200 M치ximo 450 L- Triptofano Unidad mg M칤nimo 70 M치ximo 130 L- Valina Unidad mg M칤nimo 780 M치ximo 1240 Histidina Unidad mg M칤nimo 150 M치ximo 280 Ciste칤na o cistina Unidad mg M칤nimo 0 M치ximo 55 Tirosina Unidad mg M칤nimo 0 M치ximo 33 L- Alanina Unidad mg M칤nimo 395 M치ximo 660 L- Arginina Unidad mg M칤nimo 464 M치ximo 1100 L- Prolina Unidad mg M칤nimo 445 M치ximo 950 L- Serina Unidad mg M칤nimo 220 M치ximo 575 Glicina ( ac. Aminoac칠tico ) Unidad mg M칤nimo 300 M치ximo 700 *Pirosulfito de sodio Unidad mg M칤nimo 0 M치ximo 50 Agua inyectable Unidad ml M칤nimo 0 M치ximo 100 Amino치cidos de cadena ramificada Unidad % M칤nimo 40 M치ximoual no modifica el efecto terap칠utico deseado. Presentaci칩n 500 m,Pieza,Aminoacidos enriquecidos con aminoacidos de cadena ramificada
010.000.5395.00,Tiamina. Soluci칩n Inyectable. Cada frasco 치mpula con liofilizado contiene: Clorhidrato de tiamina 500 mg. Envase con 3 frascos 치mpu,Pieza,Tiamina
010.000.5397.00,Formula o Dieta Inmunorreguladora. Polvo O Suspensi칩n Oral Contenido: 100Ml Energ칤a kcal M칤nimo 100.00 M치ximo 150.00 Prote칤nas g M칤nimo 5.60 M치ximo 9.63 Hidratos de carbono g M칤nimo 12.00 M치ximo 13.50 L칤pidos g M칤nimo 2.20 M치ximo 6.80 Sodio mg M칤nimo 58.00 M치ximo 116.80 Potasio mg M칤nimo 106.00 M치ximo 187.20 Vitamina C mg M칤nimo 6.00 M치ximo 100.00 Tiamina mg M칤nimo 0.07 M치ximo 00.30 Riboflavina mg M칤nimo 0.08 M치ximo 0.25 Niacina mg M칤nimo 1.00 M치ximo 2.80 Calcio mg M칤nimo 50.00 M치ximo 100.00 Hierro mg M칤nimo 0.90 M치ximo 1.80 Vitamina D UI M칤nimo 20.00 M치ximo 40.00 Vitamina B6 mg M칤nimo 0.14 M치ximo 1.00 Acido f칩lico 췃g  M칤nimo 20.00 M치ximo 54.00 Vitamina B12 췃g  M칤nimo 0.30 M치ximo 0.80 F칩sforo mg M칤nimo 50.00 M치ximo 100.00 Yodo 췃g  M칤nimo 7.60 M치ximo 16.00 Magnesio mg M칤nimo 20.00 M치ximo 40.00 Cobre 췃g  M칤nimo 0.20 M치ximo 3.00 Biotina 췃g  M칤nimo 15.00 M치ximo 40.00 Acido pantot칠nico mg M칤nimo 0.50 M치ximo 1.40 Vitamina K 췃g  M칤nimo 4.00 M치ximo 40.00 Colimo 174.00 Manganeso mg M칤nimo 0.20 M치ximo 0.40 Cromo 췃g  M칤nimo 7.60 M치ximo 14.00 Molibdeno 췃g  M칤nimo 7.60 M치ximo 22.00 Vitamina A UI M칤nimo 266.00 M치ximo 668.00 Retinol equivalente 췃g  M칤nimo 79.90 M치ximo 270.00 Vitamina E UI M칤nimo 5.00 M치ximo 10.00 Alfa Tocoferol mg M칤nimo 4.03 M치ximo 6.67 Zinc mg M칤nimo 1.50 M치ximo 3.60 Selenio 췃g  M칤nimo 10.00 M치ximo 10.00 Arginina mg M칤nimo 1250 M치ximo 1540 Histidina mg M칤nimo 90.00 M치ximo 216.00 Isoleucina mg M칤nimo 235 M치ximo 780 Leucina mg M칤nimo 437.00 M치ximo 1170.00 Lisina mg M칤nimo 277.00 M치ximo 620.00 Metionina mg M칤nimo 100.00 M치ximo 169.00 Cistina o ciste칤na mg M칤nimo 12.00 M치ximo 40.00 Fenilalanina mg M칤nimo 184.00 M치ximo 395.00 Tirosina mg M칤nimo 166.00 M치ximo 432.00 Treonina mg M칤nimo 150.00 M치ximo 338.00 Triptofano mg M칤nimo 34.00 M치ximo 85.00 Valina mg M칤nimo 0.74 M치ximo 946.00 Alanina mg M칤nimo 100.00 M치ximo 235.00 Acido asp치rtico mg M칤nimo 100.00 M치ximo 564.00 Glutamina mg M칤nimo 595.00 M치ximo 1490.0ina mg M칤nimo 63.00 M치ximo 196.00 Prolina mg M칤nimo 90.00 M치ximo 865.00 Serina mg M칤nimo 166.00 M치ximo 404.00 Relaci칩n omega 6/omega 3 M칤nimo 1.3/1 M치ximo 2.5/1 Osmolaridad mOsm/kg H2O M칤nimo 375 M치ximo 490 Presentaci칩n: Sobre con 123 g de polvo o lata c,Pieza,Formula o dieta inmunorreguladora
010.000.5400.00,Formula de Inicio libre de fenilalanina. Polvo contenido en: Energ칤a Unidad kcal 100G M칤nimo 470 M치ximo 550 Prote칤na Unidad g 100G M칤nimo 12.50 M치ximo 17.00 Hidratos de carbono Unidad g 100G M칤nimo 50.00 M치ximo 60.00 L칤pidos Unidad g 100G M칤nimo 20.00 M치ximo 26.00 L-Alanina Unidad g 100G M칤nimo 0 M치ximo 1.50 L-Arginina Unidad g 100G M칤nimo 0 M치ximo 1.50 L-Acido asp치rtico Unidad g 100G M칤nimo 0 M치ximo 1.50 L-Cistina Unidad g 100G M칤nimo 0.10 M치ximo 0.50 L-Acido glut치mico Unidad g 100G M칤nimo 0 M치ximo 3.00 Glicina Unidad g 100G M칤nimo 0 M치ximo 1.00 L-Histidina Unidad g 100G M칤nimo 0.20 M치ximo 0.80 L-Isoleucina Unidad g 100G M칤nimo 0.50 M치ximo 1.50 L-Leucina Unidad g 100G M칤nimo 1.50 M치ximo 2.50 L-Lisina Unidad g 100G M칤nimo 0.50 M치ximo 1.50 L-Metionina Unidad g 100G M칤nimo 0.10 M치ximo 0.50 L-Fenilalanina Unidad g 100G M칤nimo 0.00 M치ximo 0.00 L-Prolina Unidad g 100G M칤nimo 0 M치ximo 1.50 L-Serina Unidad g 100G M칤nimo 0 M치ximo 1.00 L-Treonina Unidad g 100G M칤nimo 0.50 M치x0.10 M치ximo 0.50 L-Tirosina Unidad g 100G M칤nimo 1.00 M치ximo 2.00 L-Valina Unidad g 100G M칤nimo 1.00 M치ximo 1.50 L-Carnitina Unidad g 100G M칤nimo 0 M치ximo 0.05 L-Taurina Unidad g 100G M칤nimo 0.01 M치ximo 0.05 L-Glutamina Unidad g 100G M칤nimo 0 M치ximo 0.20 Tiamina (B1) Unidad mg 100G M칤nimo 0.20 M치ximo 2.50 Riboflavina (B2) Unidad mg 100G M칤nimo 0.40 M치ximo 1.50 Niacina (B3) Unidad mg 100G M칤nimo 4.00 M치ximo 13.00 Piridoxina (B6) Unidad mg 100G M칤nimo 0.30 M치ximo 1.30 Cianocobalamina (B12) Unidad 췃g 100G M칤nimo 1.00 M치ximo 5.00 Acido f칩lico Unidad 췃g 100G M칤nimo 30.00 M치ximo 250.00 Acido pantot칠nico Unidad mg 100G M칤nimo 2.50 M치ximo 7.00 Acido asc칩rbico (Vit.C) Unidad mg 100G M칤nimo 30.00 M치ximo 70.00 Colina Unidad mg 100G M칤nimo 40.00 M치ximo 90.00 Biotina Unidad 췃g 100G M칤nimo 20.00 M치ximo 70.00 Inositol Unidad mg 100G M칤nimo 30.00 M치ximo 110.00 Vitamina A-retinol Unidad U.I. 100G M칤nimo 1400 M치ximo 1800 Vitamina D Unidad U.I. 100G M칤nimo 300 M치ximo 400 Vitamina E-alfo 12 Vitamina K Unidad 췃g 100G M칤nimo 15.00 M치ximo 55.00 Sodio Unidad mg 100G M칤nimo 100.00 M치ximo 250.00 Potasio Unidad mg 100G M칤nimo 400.00 M치ximo 700.00 Cloro Unidad mg 100G M칤nimo 250.00 M치ximo 350.00 Calcio Unidad mg 100G M칤nimo 300.00 M치ximo 700.00 F칩sforo Unidad mg 100G M칤nimo 200.00 M치ximo 460.00 Magnesio Unidad mg 100G M칤nimo 25.00 M치ximo 70.00 Hierro Unidad mg 100G M칤nimo 5.00 M치ximo 12.00 Cobre Unidad mg 100G M칤nimo 0.20 M치ximo 1.50 Zinc Unidad mg 100G M칤nimo 3.00 M치ximo 10.00 Manganeso Unidad mg 100G M칤nimo 0.20 M치ximo 0.80 Yodo Unidad 췃g 100G M칤nimo 40.00 M치ximo 80.00 Molibdeno Unidad 췃g 100G M칤nimo 10.00 M치ximo 40.00 Selenio Unidad 췃g 100G M칤nimo 12.00 M치ximo 22.00 Cromo Unidad 췃g 100G M칤nimo 10.00 M치ximo 40.00 Envase: L,Pieza,Formula de inicio libre de fenilalanina
010.000.5401.00,"F칩rmula de seguimiento libre de fenilalanina, Polvo, Contenido en: Energ칤a Unidades kcal M칤nimo/100 g 300, M치ximo/100 g 420; Prote칤na Unidades g M칤nimo/100 g 20, M치ximo/100 g 35; Hidratos de carbono Unidades g M칤nimo/100 g 30, M치ximo/100 g 65; L칤pidos Unidades g M칤nimo/100 g 0.1, M치ximo/100 g 15; L-Alanina Unidades g M칤nimo/100 g 0, M치ximo/100 g 2; L-Arginina Unidades g M칤nimo/100 g 0, M치ximo/100 g 2.5; L-Acido asp치rtico Unidades g M칤nimo/100 g 0, M치ximo/100 g 2.5; L-Cistina Unidades g M칤nimo/100 g 0.1, M치ximo/100 g 1; L-Acido glut치mico Unidades g M칤nimo/100 g 0, M치ximo/100 g 4; Glicina Unidades g M칤nimo/100 g 0, M치ximo/100 g 2.3; L-Histidina Unidades g M칤nimo/100 g 0.3, M치ximo/100 g 1.5; L-Isoleucina Unidades g M칤nimo/100 g 1.3, M치ximo/100 g 2.5; L-Leucina Unidades g M칤nimo/100 g 2.5, M치ximo/100 g 3.5; L-Lisina Unidades g M칤nimo/100 g 1.5, M치ximo/100 g 2.5; L-Metionina Unidades g M칤nimo/100 g 0.3, M치ximo/100 g 0.8; L-Fenilalanina Unidades g M칤nimo/100 g 0, M치ximo/100 g 0 M치ximo/100 g 2.5; L-Serina Unidades g M칤nimo/100 g 0.5, M치ximo/100 g 1.5; L-Treonina Unidades g M칤nimo/100 g 0.8, M치ximo/100 g 1.8; L-Tript칩fano Unidades g M칤nimo/100 g 0.2, M치ximo/100 g 0.8; L-Tirosina Unidades g M칤nimo/100 g 2, M치ximo/100 g 3.5; L-Valina Unidades g M칤nimo/100 g 1.5, M치ximo/100 g 2.6; L-Carnitina Unidades g M칤nimo/100 g 0.01, M치ximo/100 g 0.05; L-Taurina Unidades g M칤nimo/100 g 0.05, M치ximo/100 g 0.2; L-Glutamina Unidades g M칤nimo/100 g 0.2, M치ximo/100 g 0.5; Tiamina (B1) Unidades mg M칤nimo/100 g 1, M치ximo/100 g 3.5; Riboflavina (B2) Unidades mg M칤nimo/100 g 1, M치ximo/100 g 2; Niacina (B3) Unidades mg M칤nimo/100 g 10, M치ximo/100 g 25; Piridoxina (B6) Unidades mg M칤nimo/100 g 0.8, M치ximo/100 g 2; Cianocobalamina (B12) Unidades 췃g M칤nimo/100 g 2, M치ximo/100 g 6; 츼cido f칩lico Unidades 췃g M칤nimo/100 g 240, M치ximo/100 g 500; 츼cido pantot칠nico Unidades mg M칤nimo/100 g 3.5, M치ximo/100 g 8.5; 츼cido asc칩rbico (Vit.C) Unidades mg M칤nimo/100 g 45, M치ximo/100 gM치ximo/100 g 120; Biotina Unidades 췃g M칤nimo/100 g 40, M치ximo/100 g 130; Inositol Unidades mg M칤nimo/100 g 40, M치ximo/100 g 80; Vitamina A-retinol Unidades UI M칤nimo/100 g 1 400, M치ximo/100 g 1 800; Vitamina D Unidades UI M칤nimo/100 g 200, M치ximo/100 g 500; Vitamina E-alfa tocoferol Unidades UI M칤nimo/100 g 4, M치ximo/100 g 12.5; Vitamina K Unidades 췃g M칤nimo/100 g 30, M치ximo/100 g 60; Sodio Unidades mg M칤nimo/100 g 550, M치ximo/100 g 900; Potasio Unidades mg M칤nimo/100 g 800, M치ximo/100 g 1 500.00; Cloro Unidades mg M칤nimo/100 g 400, M치ximo/100 g 1 000.00; Calcio Unidades mg M칤nimo/100 g 700, M치ximo/100 g 910; F칩sforo Unidades mg M칤nimo/100 g 700, M치ximo/100 g 850; Magnesio Unidades mg M칤nimo/100 g 150, M치ximo/100 g 250; Hierro Unidades mg M칤nimo/100 g 10, M치ximo/100 g 15; Cobre Unidades mg M칤nimo/100 g 0.5, M치ximo/100 g 2; Zinc Unidades mg M칤nimo/100 g 10, M치ximo/100 g 15; Manganeso Unidades mg M칤nimo/100 g 0.05, M치ximo/100 g 2; Yodo Unidades 췃g M칤nimo/100 g 40, M치ximo/1100 g 20, M치ximo/100 g 110; Selenio Unidades 췃g M칤nimo/100 g 25, M치ximo/100 g 45; Cromo Unidades 췃g M칤nimo/100 g 25, M치ximo/100 g 45; Envase: Lata o sobre. Con medida dosificad",Pieza,Formula de seguimiento libre de fenilalanina
010.000.5402.00,Formula Libre De Fenilalanina Para Adolescente Y Adulto. Polvo Contenido En:   Energ칤a Unidades kcal 100G 297 Prote칤na Unidades g 100G 39 Hidratos de carbono Unidades g 100G 34 L칤pidos Unidades g 100G < 0.5 L-Alanina Unidades g 100G 1.7 L-Arginina Unidades g 100G 3.2 L-Acido asp치rtico Unidades g 100G 3 L-Cistina Unidades g 100G 1.2 L-Acido glut치mico Unidades g 100G 0 Glicina Unidades g 100G 3 L-Histidina Unidades g 100G 1.8 L-Isoleucina Unidades g 100G 2.8 L-Leucina Unidades g 100G 4.8 L-Lisina Unidades g 100G 3.7 L-Metionina Unidades g 100G 0.8 L-Fenilalanina Unidades g 100G 0 L-Prolina Unidades g 100G 3.4 L-Serina Unidades g 100G 2.1 L-Treonina Unidades g 100G 2.3 L-Tript칩fano Unidades g 100G 0.9 L-Tirosina Unidades g 100G 4.2 L-Valina Unidades g 100G 3.1 L-Carnitina Unidades g 100G 0.02 L-Taurina Unidades g 100G 0.15 L-Glutamina Unidades g 100G 5.2 Tiamina (B1) Unidades mg 100G 1.4 Riboflavina (B2) Unidades mg 100G 1.4 Niacina (B3) Unidades mg 100G 13.6 Piridoxina (B6) Unidades mg 100G 2.1 Cianocobal(B12) Unidades 췃g 100G 3.6 Acido f칩lico  Unidades 췃g 100G 500 Acido pantot칠nico Unidades mg 100G 5 Acido asc칩rbico (Vit.C) Unidades mg 100G 90 Colina Unidades mg 100G 321 Biotina  Unidades 췃g 100G 140 Inositol Unidades mg 100G 85.7 Vitamina A-retinol Unidades UI 100G 2364 Vitamina D Unidades UI 100G 312 Vitamina E-alfa tocoferol Unidades UI 100G 7.7 Vitamina K  Unidades 췃g 100G 70 Sodio Unidades mg 100G 560 Potasio Unidades mg 100G 700 Cloro Unidades mg 100G 560 Calcio Unidades mg 100G 670 F칩sforo Unidades mg 100G 670 Magnesio Unidades mg 100G 285 Hierro Unidades mg 100G 23.5 Cobre Unidades mg 100G 1.4 Zinc Unidades mg 100G 13.6 Manganeso Unidades mg 100G 2.1 Yodo  Unidades 췃g 100G 107 Molibdeno  Unidades 췃g 100G 107 Selenio  Unidades 췃g 100G 50 Cromo  Unidades 췃g 100G 50 Envase: Lata o sobre con medida d,Pieza,Formula libre de fenilalanina para adolescente y adulto
