clave,descr,unidad,PA
010.000.2542.00,Telmisart치n hidroclorotiazida. Tableta o c치psula. Cada Tableta o c치psula contiene: Telmisart치n 80.0 mg Hidroclorotiazida 12.5 mg Envase con 14 Tabletas o c치ps,Pieza,Telmisartan hidroclorotiazida
010.000.2620.00,쳒ido valproico. C璥sula Cada C璥sula contiene: 쳒ido valproico 250 mg Envase con 60 C璥sulas.,Pieza,Acido valproico
010.000.2655.00,Entacapona levodopa carbidopa. Tableta Cada Tableta contiene: Entacapona 200 mg Levodopa 50 mg Carbidopa monohidratada equivalente a 12.5 mg de carbidopa Envase con 30 Tabletas.,Pieza,Entacapona levodopa carbidopa
010.000.2662.00,Piridostigmina. Gragea o Tableta Cada Gragea o Tableta contiene: Bromuro de piridostigmina 60 mg Envase con 20 Grageas.,Pieza,Piridostigmina
010.000.2671.00,Dihidroergotamina paracetamol - cafe칤na. Tableta Cada Tableta contiene: Metanosulfonato de Dihidroergotamina 1 mg Paracetamol 450 mg Cafe칤na 40 mg Envase con 20 Tableta,Pieza,Dihidroergotamina paracetamol - cafeina
010.000.2714.00,Complejo b. Tableta Comprimido o C치psula. Cada tableta Comprimido o C치psula contiene: Mononitrato o clorhidrato de Tiamina 100 mg. Clorhidrato de piridoxina 5 mg. Cianocobalamina 50 췃g Envase con 30 Tabletas Comprimidos o C치psu,Pieza,Complejo b
010.000.2737.00,Aminoacidos con Electrolitos. Soluci칩n Inyectable Al 8.5%. Cada 100ml Contiene: L- Isoleucina Unidad mg M칤nimo 400 M치ximo 620 L- Leucina Unidad mg M칤nimo 520 M치ximo 810 L- Lisina Unidad mg M칤nimo 490 M치ximo 870 L- Metionina Unidad mg M칤nimo 250 M치ximo 500 L- Fenilalanina Unidad mg M칤nimo 380 M치ximo 720 L- Treonina Unidad mg M칤nimo 340 M치ximo 460 L- Triptofano Unidad mg M칤nimo 130 M치ximo 160 L- Valina Unidad mg M칤nimo 390 M치ximo 680 Histidina Unidad mg M칤nimo 240 M치ximo 380 Ciste칤na o cistina Unidad mg M칤nimo 0 M치ximo 80 Tirosina Unidad mg M칤nimo 30 M치ximo 50 L- Alanina Unidad mg M칤nimo 390 M치ximo 1760 L- Arginina Unidad mg M칤nimo 430 M치ximo 880 L- Prolina Unidad mg M칤nimo 350 M치ximo 1000 L- Serina Unidad mg M칤nimo 0 M치ximo 930 Glicina (ac. Aminoac칠tico) Unidad mg M칤nimo 460 M치ximo 1760 L-taurina Unidad mg M칤nimo 0 M치ximo 200 Acetato de sodio Unidad mEq/l M칤nimo 70 M치ximo 594 Potasio Unidad mEq/l M칤nimo 60 M치ximo 66 Cloruro de magnesio Unidad mg M칤nimo 0 M치ximo 102 Cl410 Fosfato dib치sico de potasio Unidad mg M칤nimo 400 M치ximo 522 Acido L- Asp치rtico Unidad mg M칤nimo 0 M치ximo 410 Acido glut치mico Unidad mg M칤nimo 0 M치ximo 710 Nitr칩geno total Unidad g/l M칤nimo 13.5 M치ximo 16 *Pueden o no venir en la f칩rmula lo cual no modifica el efecto terap칠utico deseado. Presen,Envase,Aminoacidos con electrolitos
010.000.2738.00,Aminoacidos Cristalinos. Solucion Inyectable Al 10% Adultos Cada 100ml Contiene    L- Isoleucina Unidad mg M칤nimo 490 M치ximo 720 L- Leucina Unidad mg M칤nimo 719 M치ximo 940 L- Lisina Unidad mg M칤nimo 599 M치ximo 720 L- Metionina Unidad mg M칤nimo 294 M치ximo 440 L- Fenilalanina Unidad mg M칤nimo 440 M치ximo 845 L- Treonina Unidad mg M칤nimo 414 M치ximo 520 L- Triptofano Unidad mg M칤nimo 153 M치ximo 210 L- Valina Unidad mg M칤nimo 572 M치ximo 800 Histidina Unidad mg M칤nimo 290 M치ximo 473 Ciste칤na o cistina Unidad mg M칤nimo 0 M치ximo 110 Tirosina Unidad mg M칤nimo 0 M치ximo 100 L- Alanina Unidad mg M칤nimo 458 M치ximo 2040 L- Arginina Unidad mg M칤nimo 505 M치ximo 1134 L- Prolina Unidad mg M칤nimo 300  M치ximo 1174 L- Serina Unidad mg M칤nimo 420 M치ximo 1092 L- Taurina Unidad mg M칤nimo 0 M치ximo 20 Glicina (ac. Aminoac칠tico) Unidad mg M칤nimo 540 M치ximo 1280 Acido L- Asp치rtico Unidad mg M칤nimo 0 M치ximo 481 Acido glut치mico Unidad mg M칤nimo 0 M치ximo 834 Acetato Unidad mEq/l M칤nimo 0 M치ximo 74itr칩geno total. Unidad g/l M칤nimo 15.5 M치ximo 16.5 Pueden o no venir en la f칩rmula lo cual no modifica el efecto terap칠utico deseado. Presentaci칩n ,Pieza,Aminoacidos cristalinos
010.000.2739.00,Dieta Polimerica A Base De Caseinato De Calcio O Proteinas Grasas Vitaminas Minerales. Polvo Cada 100 gramos contiene: Densidad energ칠tica Unidad Kcal/ml M칤nimo 0.99 M치ximo 1.06 Calor칤as Unidad Kcal M칤nimo 412.5 M치ximo 441.7 Hidratos de carbono Unidad g M칤nimo 58.50 M치ximo 68.00 Prote칤na: Unidad g M칤nimo 15.80 M치ximo 17.50 Histidina Unidad g M칤nimo 0.40 M치ximo 0.5600 Isoleucina Unidad g M칤nimo 0.7035 M치ximo 1.0135 Leucina Unidad g M칤nimo 1.4050 M치ximo 1.7670 Lisina Unidad g M칤nimo 1.1080 M치ximo 1.4525 Metionina Unidad g M칤nimo 0.3925 M치ximo 0.5256 Fenilalanina Unidad g M칤nimo 0.7810 M치ximo 0.9450 Treonina Unidad g M칤nimo 0.6466 M치ximo 0.8050 Triptofano Unidad g M칤nimo 0.1833 M치ximo 0.2450 Valina Unidad g M칤nimo 0.8553 M치ximo 1.2950 Arginina Unidad g M칤nimo 0.6165 M치ximo 0.6650 Acido asp치rtico Unidad g M칤nimo 1.0500 M치ximo 1.2310 Serina Unidad g M칤nimo 0.8750 M치ximo 0.8910 Acido glut치mico Unidad g M칤nimo 3.0100 M치ximo 3.3530 Prolina Unidad g M칤nimo 1.4700 M치ximo 1.5630 3380 Alanina Unidad g M칤nimo 0.4375 M치ximo 0.4910 Cistina Unidad g M칤nimo 0.0980 M치ximo 0.7000 Tirosina Unidad g M칤nimo 0.7414 M치ximo 1.0150 Grasas Unidad g M칤nimo 9.0 M치ximo 15.80 Acidos grasos saturados Unidad g M칤nimo 0.96 M치ximo 2.30 Acido palm칤tico Unidad g M칤nimo 0.67 M치ximo 1.77 Acido este치rico Unidad g M칤nimo 0.29 M치ximo 0.36 Grasos insaturados Unidad g M칤nimo 7.20 M치ximo 12.62 Linoleico Unidad g M칤nimo 5.8 M치ximo 8.50 Linol칠nico Unidad g M칤nimo 0.20 M치ximo 0.20 Oleico Unidad g M칤nimo 1.20 M치ximo 4.00 Relaci칩n polinsaturados/saturados Unidad g M칤nimo 0.11 M치ximo 8.20 Colesterol Unidad g M칤nimo 0.00 M치ximo 0.02 Vitamina A Unidad U.I. M칤nimo 1028.0 M치ximo 1170.0 Vitamina D Unidad U.I. M칤nimo 90.10 M치ximo 96.00 Vitamina E Unidad mg M칤nimo 10.20 M치ximo 15.00 Acido asc칩rbico Unidad mg M칤nimo 20.00 M치ximo 68.00 Acido f칩lico Unidad 췃g M칤nimo 122.00 M치ximo 200.00 Tiamina Unidad mg M칤nimo 0.70 M치ximo 0.72 Riboflavina Unidad mg M칤nimo 0.70 M치ximo 0.80 Niacina Unidad mg M칤nimo 0.90 M치ximo 1.00 Vitamina B12 Unidad 췃g M칤nimo 2.70 M치ximo 3.10 Biotina Unidad 췃g M칤nimo 61.00 M치ximo 150.00 Acido pantot칠nico Unidad mg M칤nimo 2.40 M치ximo 5.00 Vitamina K Unidad 췃g M칤nimo 18.00 M치ximo 44.10 Colina Unidad mg M칤nimo 0.0 M치ximo 136.00 Calcio Unidad mg M칤nimo 225.20 M치ximo 325.20 F칩sforo Unidad mg M칤nimo 225.20 M치ximo 268.80 Yodo Unidad 췃gM칤nimo 34.00 M치ximo 44.00 Hierro Unidad mg M칤nimo 4.10 M치ximo 5.00 Magnesio Unidad mg M칤nimo 90.10 M치ximo 105.00 Cobre Unidad mg M칤nimo 0.50 M치ximo 0.52 Zinc Unidad mg M칤nimo 4.30 M치ximo 5.40 Manganeso Unidad mg M칤nimo 0.90  M치ximo 1.20 Potasio Unidad mg M칤nimo 515.00 M치ximo 860.00 Sodio Unidad mg M칤nimo 130.00 M치ximo 360.00 Cloro Unidad mg M칤nimo 300.00 M치ximo 610.00 Selenio Unidad 췃g M칤nimo 0.0 M치ximo 19.00 Cromo Unidad 췃g M칤nimo 0.0 M치ximo 22.5 Molibdeno Unidad 췃g M칤nimo 0.0 M치ximo 3,Pieza,Dieta polimerica a base de caseinato de calcio o proteinas grasas vitaminas minerales
010.000.2801.00,Zinc y fenilefrina. Soluci칩n Oft치lmica Cada ml contiene: Sulfato de Zinc heptahidratado 2.5 mg Clorhidrato de fenilefrina 1.2 mg Envase con gotero integral con 15 ,Pieza,Zinc y fenilefrina
010.000.2804.00,Nafazolina. Soluci칩n Oft치lmica Cada ml contiene: Clorhidrato de Nafazolina 1 mg Envase con gotero integral con 15 m,Pieza,Nafazolina
010.000.2823.00,Neomicina polimixina b y gramicidina. Soluci칩n Oft치lmica Cada ml contiene: Sulfato de Neomicina equivalente a 1.75 mg de Neomicina. Sulfato de Polimixina B equivalente a 5 000 U de Polimixina B. Gramicidina 25 췃g Envase con gotero integral con 15 ,Pieza,Neomicina polimixina b y gramicidina
010.000.2824.00,Neomicina polimixina b y bacitracina. Ung칲ento Oft치lmico Cada gramo contiene: Sulfato de neomicina equivalente a 3.5 mg de neomicina. Sulfato de polimixina B equivalente a 5 000 U de polimixina B Bacitracina 400 U Envase con 3.5 ,Pieza,Neomicina polimixina b y bacitracina
010.000.2829.00,Sulfacetamida. Soluci칩n Oft치lmica Cada ml contiene: Sulfacetamida s칩dica 0.1 g Envase con gotero integral con 15 ,Pieza,Sulfacetamida
010.000.2858.00,Timolol. Soluci칩n Oft치lmica Cada ml contiene: Maleato de timolol equivalente a 5 mg de timolol. Envase con gotero integral con 5 m,Pieza,Timolol
010.000.2874.00,Homatropina. Soluci칩n Oft치lmica Cada 100 ml contienen: Bromhidrato de Homatropina 2 g Envase con gotero integral con 5 m,Pieza,Homatropina
010.000.2891.00,Proximetaca칤na. Soluci칩n Oft치lmica Cada ml contiene: Clorhidrato de Proximetaca칤na 5 mg Envase con gotero integral con 15,Pieza,Proximetacaina
010.000.2900.00,Acetilcolina cloruro de. Soluci칩n Oft치lmica. Cada frasco 치mpula con liofilizado contiene: Cloruro de Acetilcolina 20 mg Envase con un frasco 치mpula con liofilizado y ampolleta con 2 ml de diluye,Envase,Acetilcolina cloruro de
010.000.3001.00,Tiotepa. Soluci칩n Inyectable Cada frasco 치mpula con polvo contiene: Tiotepa 15 mg Envase con un frasco 치mpu,Envase,Tiotepa
010.000.3022.00,Mitomicina. Soluci칩n Inyectable Cada frasco 치mpula con polvo contiene: Mitomicina 5 mg Envase con un frasco 치mpu,Pieza,Mitomicina
010.000.3047.00,Tamoxifeno. Tableta Cada Tableta contiene: Citrato de tamoxifeno equivalente a 20 mg de tamoxifeno Envase con 14 Tabletas.,Pieza,Tamoxifeno
010.000.3050.00,Bcg inmunoterap칠utico. Suspensi칩n Cada frasco 치mpula con liofilizado contiene: Bacilo de Calmette-Guerin 81.00 mg equivalente a 1.8X108-19.2X108 UFC (unidades formadoras de colonias) Envase con un frasco 치mpula con liofilizado y un frasco 치mpula de 3 ml de diluy,Pieza,Bcg inmunoterapeutico
010.000.3132.00,Neomicina polimixina b fluocinolona y lidoca칤na. Soluci칩n 칍tica Cada 100 ml contienen: Acet칩nido de fluocinolona 0.025 g Sulfato de Polimixina B equivalente a 1 000 000 U de polimixina B Sulfato de neomicina equivalente a 0.350 g de neomicina Clorhidrato de lidoca칤na 2.0 g Envase con gotero integral con ,Pieza,Neomicina polimixina b fluocinolona y lidocaina
010.000.3143.00,Epinastina. Tableta Cada Tableta contiene: Clorhidrato de epinastina 20 mg Envase con 10 Tabletas.,Pieza,Epinastina
010.000.3150.00,Levocetirizina. Tableta Cada Tableta contiene: Diclorhidrato de Levocetirizina 5 mg Envase con 20 Tabletas.,Pieza,Levocetirizina
010.000.3400.00,Dipiridamol-치cido acetilsalic칤lico. C치psula de Liberaci칩n Prolongada Cada C치psula de Liberaci칩n Prolongada contiene: Dipiridamol 200 mg Acido acetilsalic칤lico 25 mg Envase con 60 C치psulas de Liberaci칩n P,Pieza,Dipiridamol-acido acetilsalicilico
010.000.3409.00,Colchicina. Tableta. Cada tableta contiene: Colchicina 1 mg Envase con 30 Tabletas.,Pieza,Colchicina
010.000.3415.00,Piroxicam. C치psula o Tableta Cada C치psula o Tableta contiene: Piroxicam 20 mg Envase con 20 C치psulas o Tablet,Pieza,Piroxicam
010.000.3422.00,Ketorolaco solucion inyectable cada frasco 치mpula o ampolleta contiene: ketorolaco-trometamina 30 mg envase con 3 frascos 치mpula o 3 ampolletas de 1 m,Pieza,Ketorolaco
010.000.3443.00,Orfenadrina. Soluci칩n Inyectable Cada ampolleta contiene: Citrato de orfenadrina 60 mg Envase con 6 ampolletas de 2 ml,Pieza,Orfenadrina
010.000.3444.00,Metocarbamol. Tableta Cada Tableta contiene: Metocarbamol 400 mg Envase con 30 Tabletas.,Pieza,Metocarbamol
010.000.3453.00,Probenecid. Tableta Cada Tableta contiene: Probenecid 500 mg Envase con 50 Tabletas.,Pieza,Probenecid
010.000.3461.00,Azatioprina. Tableta Cada Tableta contiene: Azatioprina 50 mg Envase con 50 Tabletas.,Pieza,Azatioprina
010.000.3503.00,Noretisterona. Soluci칩n inyectable oleosa. Cada ampolleta contiene: Enantato de noretisterona 200 mg Envase con una ampolleta de 1 ml,Pieza,Noretisterona
010.000.3506.00,Noretisterona y etinilestradiol. Tableta o Gragea Cada Tableta o Gragea contiene: Norestisterona 0.400 mg Etinilestradiol 0.035 mg Envase con 28 Tabletas o Grageas. (21 Tabletas con hormonales y 7 sin hormonales),Pieza,Noretisterona y etinilestradiol
010.000.3509.00,Medroxiprogesterona y cipionato de estradiol. Suspensi칩n Inyectable Cada ampolleta o jeringa contiene: Acetato de Medroxiprogesterona 25 mg Cipionato de estradiol 5 mg Envase con una ampolleta o jeringa prellenada de 0.5 ml,Pieza,Medroxiprogesterona y cipionato de estradiol
010.000.3510.00,Etonogestrel. Implante El Implante contiene: Etonogestrel 68.0 mg Envase con un Implante y aplicador.,Pieza,Etonogestrel
010.000.3511.00,Norelgestromina-etinilestradiol. Parche. Cada parche contiene: Norelgestromina 6.00 mg Etinilestradiol 0.60 mg Envase con 3 Parches..,Pieza,Norelgestromina-etinilestradiol
010.000.3515.00,Noretisterona y estradiol. Soluci칩n Inyectable Cada ampolleta o jeringa contiene: Enantato de noretisterona 50 mg Valerato de estradiol 5 mg Envase con una ampolleta o jeringa con un ml,Pieza,Noretisterona y estradiol
010.000.3617.00,Fosfato de potasio. Soluci칩n Inyectable. Cada ampolleta contiene: Fosfato de potasio dib치sico 1.550 g Fosfato de potasio monob치sico 0.300 g (Potasio 20 mEq) (Fosfato 20 mEq) Envase con 50 ampolletas con 10,Pieza,Fosfato de potasio
010.000.3629.00,Magnesio sulfato de. Soluci칩n Inyectable Cada ampolleta contiene: Sulfato de magnesio 1g (Magnesio 8.1 mEq sulfato 8.1 mEq) Envase con 100 ampolletas de 10 ml con 1 g (100 mg/1 ml),Pieza,Magnesio sulfato de
010.000.3826.00,L-ornitina-L-aspartato. Soluci칩n Inyectable Cada ampolleta contiene: L-ornitina-L-aspartato 5 g Envase con 5 ampolletas con 10 ml,Pieza,L-ornitina-l-aspartato
010.000.4028.00,Clonixinato de lisina soluci칩n inyectable cada ampolleta contiene: clonixinato de lisina 100 mg envase con 5 ampolletas de 2 ml,Pieza,Clonixinato de lisina
010.000.4031.00,Capsaicina crema cada 100 gramos contiene: extracto de oleoresina del capsicum annuuna equivalente a 0.035 g de capsaicina. Envase con 40 g.,Pieza,Capsaicina
010.000.4036.00,Etofenamato solucion inyectable cada ampolleta contiene: etofenamato 1 g envase con una ampolleta de 2 ml.,Pieza,Etofenamato
010.000.4059.00,Rocuronio bromuro de. Soluci칩n Inyectable Cada ampolleta o frasco 치mpula contiene: Bromuro de rocuronio 50 mg Envase con 12 ampolletas o frascos 치mpula de 5 ,Pieza,Rocuronio bromuro de
010.000.4061.00,Cisatracurio besilato de. Soluci칩n InyectableCada ml contiene:Besilato de cisatracurioequivalente a 2 mgde cisatracurioEnvase con 1 ampolleta con 5 ml,Pieza,Cisatracurio besilato de
010.000.4112.00,Resina de colestiramina. Polvo. Cada sobre contiene: Resina de colestiramina 4 g Envase con 50 sobres.,Pieza,Resina de colestiramina
010.000.4113.00,Polidocanol. Soluci칩n Inyectable Cada ml contiene: Polidocanol 30 mg Envase con un frasco 치mpula con 30 m,Pieza,Polidocanol
010.000.4126.00,Sulfadiazina de plata. Crema Cada 100 gramos contiene: Sulfadiazina de plata micronizada 1 g Envase con 375 g.,Pieza,Sulfadiazina de plata
010.000.4130.00,Tacalcitol. Ung칲ento Cada 100 gramos contiene: Tacalcitol 0.417 mg Envase con 30 g,Pieza,Tacalcitol
010.000.4140.00,Imiquimod. Crema al 5% Cada sobre contiene: Imiquimod 12.5 mg Envase con 12 sobres que contienen 250 mg de Crema.,Pieza,Imiquimod
010.000.4149.00,Pioglitazona. Tableta Cada Tableta contiene: Clorhidrato de pioglitazona equivalente a 15 mg de pioglitazona. Envase con 7 Tabletas.,Pieza,Pioglitazona
010.000.4151.00,Coriogonadotropina alfa. Soluci칩n Inyectable Cada jeringa prellenada con 0.5 ml contiene: Coriogonadotropina alfa 250 췃g Envase con una jeringa prellena,Pieza,Coriogonadotropina alfa
010.000.4154.00,Vasopresina. Soluci칩n Inyectable Cada ampolleta contiene: Vasopresina 20 UI Envase con una ampolleta,Pieza,Vasopresina
010.000.4160.00,Fludrocortisona. Comprimido Cada Comprimido contiene: Acetato de fludrocortisona 0.1 mg Envase con 100 Comprimidos.,Pieza,Fludrocortisona
010.000.4162.00,Insulina lispro. Soluci칩n Inyectable. Cada ml contiene: Insulina lispro (origen ADN recombinante) 100 UI Envase con un frasco 치mpula con 10 m,Pieza,Insulina lispro
010.000.4168.00,Insulina glulisina. Soluci칩n Inyectable Cada mililitro contiene: Insulina glulisina equivalente a 100 UI de insulina humana Envase con frasco 치mpula con 10 m,Pieza,Insulina glulisina
010.000.4174.00,Teriparatida. Soluci칩n Inyectable Cada mililitro contiene: Teriparatida 250 췃g Envase con pluma con cartucho ensamblado de 2.4 m,Pieza,Teriparatida
010.000.4176.00,Neomicina. C치psula o Tableta Cada Tableta o C치psula contiene: Sulfato de neomicina equivalente a 250 mg de neomicina. Envase con 10 C치psulas o Tablet,Pieza,Neomicina
010.000.4184.00,Loperamida. Comprimido tableta o gragea. Cada comprimido tableta o gragea contiene: Clorhidrato de loperamida 2 mg. Envase con 12 comprimidos tabletas o grageas.,Pieza,Loperamida
010.000.4191.00,Polietilenglicol. Polvo .Cada sobre contiene: Polietilenglicol 3350 105 g. Envase con 4 sobres.,Pieza,Polietilenglicol
010.000.4194.00,Tegaserod. Comprimido Cada Comprimido contiene: Maleato hidrogenado de tegaserod equivalente a 6.0 mg de tegaserod. Envase con 10 Comprimidos,Pieza,Tegaserod
010.000.4200.00,Nesiritida. Soluci칩n Inyectable Cada frasco 치mpula con liofilizado contiene: Citrato de nesiritida a 1.58 mg de nesiritida. Envase con un frasco 치mpu,Pieza,Nesiritida
010.000.4206.00,Estriol. Crema Cada 100 g contienen: Estriol 100 mg Envase con 15 g.,Pieza,Estriol
010.000.4220.00,Fondaparinux. Soluci칩n Inyectable Cada jeringa contiene: Fondaparinux s칩dico 2.5 mg Envase con 2 Jeringas. prellenad,Pieza,Fondaparinux
010.000.4226.00,Hidroxicarbamida. C치psula Cada C치psula contiene: Hidroxicarbamida 500 mg Envase con 100 C치psul,Pieza,Hidroxicarbamida
010.000.4228.00,Daunorubicina. Soluci칩n Inyectable Cada frasco 치mpula con liofilizado contiene: Clorhidrato de daunorubicina equivalente a 20 mg de daunorubicina. Envase con un frasco 치mpu,Pieza,Daunorubicina
010.000.4230.00,Etop칩sido. Soluci칩n Inyectable Cada ampolleta o frasco 치mpula contiene: Etop칩sido 100 mg Envase con 10 ampolletas o frascos 치mpula de ,Pieza,Etoposido
010.000.4232.00,Globulina equina antitimoc칤tica humana. Soluci칩n Inyectable Cada ml contiene: Globulina equina antitimoc칤tica humana 50 mg Envase con 5 ampolletas de 5 ,Pieza,Globulina equina antitimocitica humana
010.000.4233.00,Mitoxantrona. Soluci칩n Inyectable Cada frasco 치mpula contiene: Clorhidrato de mitoxantrona equivalente a 20 mg de mitoxantrona base Envase con un frasco 치mpula con 10 ,Pieza,Mitoxantrona
010.000.4237.00,쳒ido aminocaproico. Soluci蚤 Inyectable Cada frasco 炅pula contiene: 쳒ido aminocaproico 5 g Envase con un frasco 炅pula con 20 ml.,Pieza,Acido aminocaproico
010.000.4239.00,Factor antihemof칤lico humano. Soluci칩n Inyectable Cada frasco 치mpula con liofilizado contiene: Factor antihemof칤lico humano 250 UI Envase con un frasco 치mpula frasco 치mpula con diluyente y equipo para administr,Pieza,Factor antihemofilico humano
010.000.4247.00,Abciximab. Soluci칩n Inyectable Cada frasco 치mpula contiene: Abciximab 10 mg Envase con un frasco 치mpula (10 mg/5m,Pieza,Abciximab
010.000.4251.00,Vancomicina. Soluci칩n Inyectable Cada frasco 치mpula con polvo contiene: Clorhidrato de vancomicina equivalente a 500 mg de vancomicina. Envase con un frasco 치mpu,Pieza,Vancomicina
010.000.4254.00,Ceftazidima. Soluci칩n Inyectable. Cada frasco 치mpula con polvo contiene: Ceftazidima pentahidratada equivalente a 1 g de ceftazidima. Envase con un frasco 치mpula y 3 ml de diluyen,Pieza,Ceftazidima
010.000.4256.00,Talidomida. Tableta o C치psula Cada Tableta o C치psula contiene: Talidomida 100 mg Envase con 50 Tabletas 칩 C치psu,Pieza,Talidomida
010.000.4265.00,Ciprofibrato. C치psula o Tableta. Cada C치psula o Tableta contiene: Ciprofibrato 100 mg Envase con 30 c치psulas o tablet,Pieza,Ciprofibrato
010.000.4268.00,Lamivudina/zidovudina. Tableta Cada Tableta contiene: Lamivudina 150 mg Zidovudina 300 mg Envase con 60 Tabletas.,Pieza,Lamivudina/zidovudina
010.000.4274.00,Tipranavir. C치psula Cada C치psula contiene: Tipranavir 250 mg Envase con 120 C치psul,Pieza,Tipranavir
010.000.4275.00,Amprenavir. C치psula Cada C치psula contiene: Amprenavir 150 mg Envase con 240 C치psul,Pieza,Amprenavir
010.000.4276.00,Emtricitabina. C치psula Cada C치psula contiene: Emtricitabina 200 mg Envase con 30 C치psul,Pieza,Emtricitabina
010.000.4277.00,TENOFOVIR TABLETA Cada tableta contiene: Tenofovir disoproxil fumarato 300 mg. Envase con 30 tabletas.,Pieza,Tenofovir
010.000.4278.00,Fosamprenavir. Tableta recubierta. Cada tableta recubierta contiene: Fosamprenavir c치lcico equivalente a 700 mg de fosamprenavir Envase con 60. Tabletas recubiertas,Pieza,Fosamprenavir
010.000.4302.00,Finasterida. Gragea o Tableta Recubierta. Cada gragea o tableta recubierta contiene: Finasterida 5 mg Envase con 30 Grageas o Tabletas recubiertas.,Pieza,Finasterida
010.000.4307.00,Cilostazol. Tableta Cada Tableta contiene: Cilostazol 100 mg Envase con 30 Tabletas.,Pieza,Cilostazol
010.000.4323.00,Dasatinib. Tableta Cada Tableta contiene: Dasatinib 50 mg Envase con 60 Tabletas,Pieza,Dasatinib
010.000.4324.00,Factor viii de la coagulaci칩n humano. Soluci칩n Inyectable Cada frasco 치mpula con liofilizado contiene: Factor VIII de la coagulaci칩n humano 500 UI Envase con un frasco 치mpula con liofilizado un frasco 치mpula con 5 ml 칩 10 ml de diluyente y equipo para adminis,Pieza,Factor viii de la coagulacion humano
010.000.4326.00,Acetilciste칤na. Soluci칩n al 20% Cada ampolleta contiene: Acetilciste칤na 400 mg Envase con 5 ampolletas con 2 ml (200 mg/m,Pieza,Acetilcisteina
010.000.4357.00,Sumatript치n. Soluci칩n Inyectable Cada 0.5 ml contiene: Succinato de sumatript치n equivalente a 6 mg de sumatript치n. Envase con una jeringa con 0.5,Pieza,Sumatriptan
010.000.4359.00,Gabapentina. C치psula. Cada c치psula contiene: Gabapentina 300 mg Envase con 15 C치psul,Pieza,Gabapentina
010.000.4368.00,Abacavir-lamivudina-zidovudina. Tableta Cada Tableta contiene: Sulfato de abacavir. Equivalente a 300 mg de abacavir. Lamivudina 150 mg. Zidovudina 300 mg. Envase con 60 tabletas.,Pieza,Abacavir-lamivudina-zidovudina
010.000.4371.00,Abacavir-lamivudina. Tableta. Cada tableta contiene: Sulfato de abacavir equivalente a 600 mg de abacavir. Lamivudina 300 mg. Envase con 30 tabletas.,Pieza,Abacavir-lamivudina
010.000.4373.00,Valganciclovir. Comprimido Cada Comprimido contiene: Clorhidrato de valganciclovir equivalente a 450 mg de valganciclovir. Envase con 60 Comprimidos,Pieza,Valganciclovir
010.000.4374.00,Zanamivir. PoLVo Cada dosis de polvo contiene: Zanamivir 5 mg Envase con 5 discos de aluminio cada uno con 4 dosis de 5 mg y un dispositivo inhalador.,Pieza,Zanamivir
010.000.4375.00,Adefovir. Tableta Cada Tableta contiene: Dipivoxilo de adefovir 10 mg Envase con 30 Tabletas,Pieza,Adefovir
010.000.4378.00,Selenio. Soluci칩n Inyectable. Cada ml contiene Selenio 40.0 췃g. Envase con un frasco 치mpula con 10 ,Pieza,Selenio
010.000.4396.00,EMTRICITABINA-TENOFOVIR DISOPROXIL O EMTRICITABINA-TENOFOVIR DISOPROXIL FUMARATO. TABLETA RECUBIERTA. Cada tableta recubierta contiene:Tenofovir disoproxil 245 mg o Tenofovir disoproxil fumarato  300 mg equivalente a 245 mg de Tenofovir disoproxil Emtricitabina 200 mg. Envase con 30 tabletas recubiertas.,Pieza,Emtricitabina-tenofovir disoproxil o emtricitabina-tenofovir disoproxil fumarato
010.000.4396.01,Emtricitabina-tenofovir. Tableta. Cada Tableta contiene: Tenofovir disoproxil succinato equivalente a 245 mg de tenofovir disoproxil Emtricitabina 200 mg Envase con 30 Tabletas.,Pieza,Emtricitabina-tenofovir
010.000.4407.00,Tetraca칤na. Soluci칩n Oft치lmica Cada ml contiene: Clorhidrato de Tetraca칤na 5.0 mg Envase con gotero integral con 10,Pieza,Tetracaina
010.000.4410.00,Dorzolamida. Soluci칩n Oft치lmica Cada ml contiene: Clorhidrato de dorzolamida equivalente a 20 mg de dorzolamida Envase con gotero integral con 5 m,Pieza,Dorzolamida
010.000.4412.00,Dorzolamida y timolol. Soluci칩n Oft치lmica Cada ml contiene: Clorhidrato de dorzolamida equivalente a 20 mg de dorzolamida Maleato de timolol equivalente a 5 mg de timolol Envase con gotero integral con 5 ,Pieza,Dorzolamida y timolol
010.000.4413.00,Brimonidina. Soluci칩n Oft치lmica Cada ml contiene: Tartrato de brimonidina 2.0 mg Envase con frasco gotero con 5 m,Pieza,Brimonidina
010.000.4415.00,Verteporfina. Soluci칩n Inyectable Cada frasco 치mpula con liofilizado contiene: Verteporfina 15 mg Envase con un frasco 치mpu,Pieza,Verteporfina
010.000.4418.00,Travoprost. Soluci칩n Oft치lmica Cada ml contiene: Travoprost 40 췃g Envase con un frasco gotero con 2.5 ,Pieza,Travoprost
010.000.4420.00,Brimonidina - timolol. Soluci칩n Oft치lmica Cada mililitro contiene: Tartrato de brimonidina 2.00 mg Maleato de timolol 6.80 mg Envase con gotero integral con 5 m,Pieza,Brimonidina - timolol
010.000.4428.00,Lomustina. C치psula. Cada frasco con dos c치psulas contiene: Lomustina: 10 mg Lomustina 40 mg Lomustina 100 mg Envase con 3 frascos conteniendo 2 C치psulas de cada una de las cantidad,Pieza,Lomustina
010.000.4429.00,Dactinomicina. Soluci칩n Inyectable Cada frasco 치mpula con liofilizado contiene: Dactinomicina 0.5 mg Envase con un frasco 치mpu,Pieza,Dactinomicina
010.000.4433.00,MESNA. SOLUCI칍N INYECTABLE Cada ampolleta o frasco 치mpula o vial contiene: Mesna 400 mg Envase con 5 ampolletas o frascos 치mpula o viales con 4 mL (100 mg/m,Envase,Mesna
010.000.4436.00,Oprelvekina. Soluci칩n Inyectable Cada frasco 치mpula con liofilizado contiene: oprelvekina 5 mg Envase con un frasco 치mpula con liofilizado y frasco 치mpula con 1 ml de diluye,Pieza,Oprelvekina
010.000.4437.00,Palonosetr칩n. Soluci칩n Inyectable Cada frasco 치mpula contiene: Clorhidrato de palonosetr칩n equivalente a 0.25 mg de palonosetr칩n Envase con un frasco 치mpula con,Pieza,Palonosetron
