clave,descr,unidad,PA
010.000.5403.00,Alimento m칠dico para pacientes con trastorno del ciclo de la urea Recien nacidos a 7 a침os 11 Meses de edad. Polvo. Cada 100G Contiene: Energ칤a Unidad Kcal M칤nimo 500.00 M치ximo 510.00 Prote칤na Unidad g M칤nimo 6.50 M치ximo 7.50 Hidratos de carbono Unidad g M칤nimo 57.00 M치ximo 60.00 L칤pidos Unidad g M칤nimo 24.60 M치ximo 26.00 L-Alanina Unidad g M칤nimo 0 M치ximo 0 L-Arginina Unidad g M칤nimo 0 M치ximo 0 L-Acido asp치rtico Unidad g M칤nimo 0 M치ximo 0 L-Cistina Unidad g M칤nimo 0.30 M치ximo 0.32 L-Acido glut치mico Unidad g M칤nimo 0 M치ximo 0 Glicina Unidad g M칤nimo 0 M치ximo 0 L-Histidina Unidad g M칤nimo 0.36 M치ximo 0.44 L-Isoleucina Unidad g M칤nimo 0.99 M치ximo 1.28 L-Leucina Unidad g M칤nimo 2.00 M치ximo 2.17 L-Lisina Unidad g M칤nimo 1.11 M치ximo 1.24 L-Metionina Unidad g M칤nimo 0.25 M치ximo 0.34 L-Fenilalanina Unidad g M칤nimo 0.67 M치ximo 0.75 L-Treonina Unidad g M칤nimo 0.75 M치ximo 0.85 L-Tript칩fano Unidad g M칤nimo 0.38 M치ximo 0.39 L-Tirosina Unidad g M칤nimo 0.80 M치ximo 0.88 L-Valina Unidad mg M칤nimo 1.00 M치ximo 2.00 Riboflavina (B2) Unidad mg M칤nimo 0.98 M치ximo 1.20 Niacina (B3) Unidad 췃g M칤nimo 10000.00 M치ximo 16700.00 Piridoxina (B6) Unidad mg M칤nimo 0.85 M치ximo 1.00 Cianocobalamina (B12) Unidad 췃g M칤nimo 2.00 M치ximo 5.60 Acido f칩lico Unidad 췃g M칤nimo 100.00 M치ximo 250.00 Acido pantot칠nico Unidad 췃g M칤nimo 3.80 M치ximo 7.80 Acido asc칩rbico (vit.C) Unidad mg M칤nimo 55.00 M치ximo 60.00 Colina Unidad mg M칤nimo 60.00 M치ximo 100.00 Biotina Unidad 췃g M칤nimo 38.00 M치ximo 75.00 Inositol Unidad mg M칤nimo 50.00 M치ximo 86.00 Vitamina A Unidad UI M칤nimo 533.00 M치ximo 1600.00 Vitamina D Unidad UI M칤nimo 300.00 M치ximo 360.00 Vitamina E Unidad UI M칤nimo 10.00 M치ximo 17.01 Vitamina K Unidad 췃g M칤nimo 40.00 M치ximo 60.00 Sodio Unidad mg M칤nimo 215.00 M치ximo 240.00 Potasio Unidad mg M칤nimo 560.00 M치ximo 790.00 Cloro Unidad mg M칤nimo 390.00 M치ximo 420.00 Calcio Unidad mg M칤nimo 650.00 M치ximo 660.00 F칩sforo Unidad mg M칤nimo 440.00 M치ximo 455.00 Magnesio Unidaimo 860.00 M치ximo 1250.00 Zinc Unidad mg M칤nimo 8.60 M치ximo 9.50 Manganeso Unidad 췃g M칤nimo 380.00 M치ximo 500.00 Yodo Unidad 췃g M칤nimo 76.00 M치ximo 80.00 Selenio Unidad 췃g M칤nimo 14.10 M치ximo 25.00. Envase: lata con medida d,Pieza,Alimento medico
010.000.5420.00,Ciproterona. Tableta Cada Tableta contiene: Acetato de ciproterona (micro 20) 50.0 mg Envase con 20 Tabletas.,Pieza,Ciproterona
010.000.5421.00,Lapatinib. Tableta Cada Tableta contiene: Ditosilato de lapatinib equivalente a 250 mg de lapatinib Envase con 70 Tabletas.,Pieza,Lapatinib
010.000.5424.00,Nilutamida. Comprimido Cada Comprimido contiene: Nilutamida 150 mg Envase con 30 Comprimidos.,Pieza,Nilutamida
010.000.5425.00,Raltitrexed. Soluci칩n Inyectable Cada frasco 치mpula con liofilizado contiene: Raltitrexed 2 mg Envase con un frasco 치mpu,Pieza,Raltitrexed
010.000.5426.00,Flutamida. Tableta Cada Tableta contiene: Flutamida 250 mg Envase con 90 Tabletas.,Pieza,Flutamida
010.000.5429.00,Molgramostim. Soluci칩n Inyectable Cada frasco 치mpula con liofilizado contiene: Molgramostim 400 췃g Envase con un frasco 치mpula y una ampolleta con diluyente de un,Pieza,Molgramostim
010.000.5432.00,Filgrastim. Soluci칩n Inyectable Cada frasco 치mpula o jeringa contiene: Filgrastim 300 췃g Envase con 5 frascos 치mpula o Jerin,Pieza,Filgrastim
010.000.5439.00,Amifostina. Soluci칩n Inyectable. Cada frasco 치mpula contiene: Amifostina (base anhidra) 500 mg Envase con un frasco 치mpu,Pieza,Amifostina
010.000.5443.00,Estramustina. C치psula Cada C치psula contiene: Fosfato s칩dico de estramustina equivalente a 140 mg de fosfato de estramustina. Envase con 100 C치ps,Pieza,Estramustina
010.000.5444.00,Irinotecan. Soluci칩n Inyectable El frasco 치mpula contiene: Clorhidrato de irinotecan 칩 clorhidrato de irinotecan trihidratado 100 mg Envase con un frasco 치mpula con ,Pieza,Irinotecan
010.000.5447.00,Mecloretamina. Soluci칩n Inyectable Cada frasco 치mpula contiene: Clorhidrato de mecloretamina 10 mg Envase con 1 frasco 치mpu,Pieza,Mecloretamina
010.000.5449.00,Anastrozol. Tableta Cada Tableta contiene: Anastrozol 1 mg Envase con 28 Tabletas,Pieza,Anastrozol
010.000.5451.00,Cinarizina. Tableta Cada Tableta contiene: Cinarizina 75 mg Envase con 60 Tabletas,Pieza,Cinarizina
010.000.5453.00,Pemetrexed. Soluci칩n Inyectable Cada frasco 치mpula con liofilizado contiene: Pemetrexed dis칩dico heptahidratado o Pemetrexed dis칩dico equivalente a 500 mg de pemetrexed Envase con frasco 치m,Pieza,Pemetrexed
010.000.5454.00,Tietilperazina. Supositorio Cada Supositorio contiene: Maleato de tietilperazina 6.5 mg Envase con 6 Supositorios.,Pieza,Tietilperazina
010.000.5462.00,Buserelina. Implante de Liberaci칩n Prolongada Cada Implante contiene: Acetato de buserelina equivalente a 9.45 mg de buserelina Caja con sobre-bolsa con una jeringa precargada con un Implant,Pieza,Buserelina
010.000.5466.00,Cultivo bcg. Suspensi칩n Cada frasco con liofilizado contiene: Mycobacterium bovis (BCG) cepa danesa 1331 30 mg Envase con 4 frascos 치mpul,Pieza,Cultivo bcg
010.000.5468.00,쳒ido zoledr蚤ico. Soluci蚤 Inyectable Cada frasco 炅pula con 5 ml contiene: Acido zoledr蚤ico monohidratado equivalente a 4.0 mg de 徑ido zoledr蚤ico Envase con un frasco 炅pula.,Pieza,Acido zoledronico
010.000.5469.00,Clodronato dis칩dico. Comprimido. Cada comprimido contiene: Clodronato dis칩dico tetrahidratado equivalente a 800 mg de clodronato dis칩dico Envase con 60 Comprimid,Pieza,Clodronato disodico
010.000.5470.00,Gefitinib. Tableta Cada Tableta contiene: Gefitinib 250 mg Envase con 30 Tabletas.,Pieza,Gefitinib
010.000.5480.00,Sorafenib. Comprimido Cada Comprimido contiene: Tosilato de sorafenib equivalente a 200 mg de sorafenib Envase con 112 Comprimidos.,Pieza,Sorafenib
010.000.5481.00,Paroxetina. Tableta Cada Tableta contiene: Clorhidrato de paroxetina equivalente a 20 mg de paroxetina. Envase con 10 Tabletas.,Pieza,Paroxetina
010.000.5482.00,Sunitinib. C치psula Cada C치psula contiene: Malato de sunitinib equivalente a 12.5 mg de sunitinib Envase con 28 C치psul,Pieza,Sunitinib
010.000.5490.00,Mirtazapina. Tableta o Tableta Dispersable Cada Tableta o Tableta Dispersable contiene: Mirtazapina 30 mg Envase con 30 Tabletas o Tabletas Dispersables,Pieza,Mirtazapina
010.000.5502.00,Levamisol. Tableta Cada Tableta contiene: Clorhidrato de levamisol equivalente a 50 mg de levamisol. Envase con 2 Tabletas.,Pieza,Levamisol
010.000.5503.00,Sulindaco. Tableta o Gragea Cada Tableta o Gragea contiene: Sulindaco 200 mg Envase con 20 Tabletas o Grageas.,Pieza,Sulindaco
010.000.5541.00,Letrozol. Gragea o Tableta Cada Gragea o Tableta contiene: Letrozol 2.5 mg Envase con 30 Grageas o Tabletas,Pieza,Letrozol
010.000.5543.00,Galsulfasa. Soluci칩n Inyectable. Cada frasco 치mpula contiene: Galsulfasa 5 mg Envase con un frasco 치mpula con 5 ml (1 mg/m,Pieza,Galsulfasa
010.000.5545.00,Imiglucerasa. Soluci칩n Inyectable Cada frasco 치mpula con polvo contiene: Imiglucerasa 400 U Envase con frasco 치mpula con polvo liofiliza,Pieza,Imiglucerasa
010.000.5547.00,Laronidasa. Soluci칩n Inyectable Cada frasco 치mpula contiene: Laronidasa 2.9 mg (500 U) Envase con frasco 치mpula con 5 ml (2.9 mg o 500,Pieza,Laronidasa
010.000.5548.00,Alglucosidasa alfa. Soluci칩n Inyectable Cada frasco 치mpula con polvo contiene: alglucosidasa alfa 50 mg Envase con frasco 치mpula con polvo liofiliza,Pieza,Alglucosidasa alfa
010.000.5549.00,Agalsidasa alfa. Soluci칩n Inyectable Cada frasco 치mpula contiene: Agalsidasa alfa 3.5 mg Envase con frasco 치mpula con 3.5 ml (1 mg/m,Pieza,Agalsidasa alfa
010.000.5550.00,Idursulfasa. Soluci칩n Inyectable. Cada frasco 치mpula contiene: Idursulfasa 6 mg Envase con frasco 치mpula con 3 ml (6 mg/3 m,Pieza,Idursulfasa
010.000.5612.00,Calcipotriol betametasona. Ung칲ento Cada 100 g contienen: Calcipotriol 5 mg Dipropionato de betametasona equivalente a 50 mg de betametasona Envase con 30 g,Pieza,Calcipotriol betametasona
010.000.5614.00,Taliglucerasa alfa. Soluci칩n Inyectable Cada frasco 치mpula con liofilizado contiene: Taliglucerasa alfa 200 U Envase con frasco 치mpula con polvo liofiliza,Pieza,Taliglucerasa alfa
010.000.5615.00,Velaglucerasa alfa. Soluci칩n Inyectable Cada frasco 치mpula con liofilizado contiene: Velaglucerasa alfa 400 U Envase con frasco 치mpula con liofiliza,Pieza,Velaglucerasa alfa
010.000.5620.00,Vildagliptina. Comprimido Cada Comprimido contiene: Vildagliptina 50 mg Envase con 28 Comprimidos.,Pieza,Vildagliptina
010.000.5621.00,Linagliptina. Tableta. Cada tableta contiene: Linagliptina 5 mg. Envase con 30 tabletas.,Pieza,Linagliptina
010.000.5622.00,Saxagliptina. Tableta Cada Tableta contiene: Clorhidrato de Saxagliptina monohidratada equivalente a 5 mg de saxagliptina Envase con 28 Tabletas.,Pieza,Saxagliptina
010.000.5624.00,Romiplostim. Soluci칩n Inyectable Cada frasco 치mpula con polvo contiene: Romiplostin 375 췃g. Envase con un frasco 치mpula con polvo (250 췃g/0.5 ml reconstitu,Pieza,Romiplostim
010.000.5630.00,Clopidogrel 치cido acetilsalic칤lico. Tableta Cada tableta contiene: Bisulfato de clopidogrel equivalente a 75 mg de clopidogrel Acido acetilsalic칤lico 100 mg. Envase con 28 tablet,Pieza,Clopidogrel acido acetilsalicilico
010.000.5634.00,Bemiparina de sodio. Soluci칩n Inyectable Cada jeringa prellenada contiene: Bemiparina de sodio 3 500 UI Envase con 2 Jeringas prellenadas con 0.2 ml,Pieza,Bemiparina de sodio
010.000.5650.00,Mifamurtida. Suspensi칩n Inyectable Cada frasco 치mpula contiene: Mifamurtida 4 mg Envase con frasco 치mpula con po,Pieza,Mifamurtida
010.000.5653.00,Panitumumab. Soluci칩n Inyectable Cada frasco 치mpula contiene: Panitumumab 100 mg Envase con frasco 치mpula con 5 ,Pieza,Panitumumab
010.000.5658.00,Cabazitaxel. Soluci칩n Inyectable. Cada frasco 치mpula contiene: Cabazitaxel acetona solvato 60 mg Envase con un frasco 치mpula con 1.5 ml y un frasco 치mpula con 4.5 ml de diluye,Pieza,Cabazitaxel
010.000.5665.00,RASAGILINA. TABLETA Cada tableta contiene: Mesilato o tartrato de rasagilina equivalente a 1 mg de rasagilina. Envase con 30 tabletas.,Pieza,Rasagilina
010.000.5670.00,Anidulafungina. Soluci칩n Inyectable Cada frasco 치mpula con liofilizado contiene: Anidulafungina 122 mg con una potencia de 84% equivale a 102.5 mg de anidulafungina Envase con un frasco 치mpula con liofiliza,Pieza,Anidulafungina
010.000.5675.00,Boceprevir. C치psula Cada C치psula contiene: Boceprevir 200 mg Envase con cuatro cajas con 84 C치psulas cada u,Pieza,Boceprevir
010.000.5699.00,Etoricoxib. Comprimido Cada Comprimido contiene: Etoricoxib 90 mg Envase con 28 Comprimidos.,Pieza,Etoricoxib
010.000.5740.01,METFORMINA/ LINAGLIPTINA. TABLETA Cada tableta contiene: Clorhidrato de Metformina 500 mg Linagliptina 2.5 mg Envase con 30 tabletas.,Envase,Metformina/ linagliptina
010.000.5743.00,Liraglutide. Soluci칩n Inyectable Cada mililitro contiene: Liraglutide (ADN recombinante) 6 mg Envase con 2 plumas con cartucho de 3 m,Pieza,Liraglutide
010.000.5795.00,Certolizumab pegol. Soluci칩n Inyectable Cada jeringa prellenada contiene: Certolizumab pegol 200 mg Envase con 2 Jeringas. prellenadas con 1 m,Pieza,Certolizumab pegol
010.000.5800.00,Amlodipino/valsart치n/hidroclorotiazida. Comprimido Cada Comprimido contiene: Besilato de Amlodipino equivalente a 5 mg de Amlodipino Valsart치n 160 mg Hidroclorotiazida 12.5 mg Envase con 28 Comprimid,Pieza,Amlodipino/valsartan/hidroclorotiazida
010.000.5835.00,Cinacalcet. Tableta Cada Tableta contiene: Cinacalcet 30 mg Envase con 30 Tabletas.,Pieza,Cinacalcet
010.000.5848.00,Iloprost. Soluci칩n para nebulizar. Cada mililitro contiene: Iloprost trometanol 0.0134 mg equivalente a 0.010 mg de Iloprost Envase con 30 ampolletas con 2 ml cada una,Pieza,Iloprost
010.000.5865.00,Colistimetato. Soluci칩n Inyectable Cada frasco 치mpula con liofilizado contiene: Colistimetato s칩dico equivalente a 150 mg de colistimetato Envase con un frasco 치mpula con liofiliz,Pieza,Colistimetato
010.000.5880.00,Fulvestrant. Soluci칩n Inyectable. Cada jeringa prellenada contiene: Fulvestrant 250 mg Envase con 2 Jeringas. prellenadas con 5 ml cada una,Pieza,Fulvestrant
010.000.5887.00,Azacitidina suspensi칩n inyectable cada frasco 치mpula con liofilizado contiene: azacitidina 100 mg. Envase con un frasco 치mpula con liofiliza,Pieza,Azacitidina
010.000.5890.00,Terbinafina. Soluci칩n T칍PICA Cada gramo contiene: Clorhidrato de terbinafina equivalente a 10.0 mg de terbinafina Envase con 4 ,Pieza,Terbinafina
010.000.5900.00,Almotriptan. Comprimidos. Cada comprimido contiene: almotript치n D L malato 치cido equivalente a 12.5 mg de almotript치n. Envase con 2 comprimid,Pieza,Almotriptan
010.000.5920.01,Ribavirina C츼PSULA O TABLETA  Cada c치psula o tableta contiene: Ribavirina 200 mg Envase con 168 tableta,Pieza,Ribavirina
010.000.5931.00,Enoxaparina s칩dica. Soluci칩n Inyectable Cada jeringa contiene: Enoxaparina s칩dica 80 mg Envase con 2 Jeringas. con dispositivo de seguridad de 0.8 ,Pieza,Enoxaparina sodica
010.000.5935.00,Dabigatr치n. C치psula Cada C치psula contiene: Dabigatr치n etexilato mesilato equivalente a 150 mg de dabigatr치n etexilato Envase con 60 C치p,Pieza,Dabigatran
010.000.5980.00,Fluticasona vilanterol. PoLVo Para Inhalaci칩n Cada dosis contiene: Furoato de fluticasona 100 췃g Vilanterol trifenatato equivalente a 25 췃g de vilanterol Envase con dispositivo inhalador con 30 dos,Pieza,Fluticasona vilanterol
010.000.5990.00,Icatibant. Soluci칩n Inyectable Cada jeringa prellenada contiene: Acetato de icatibant equivalente a 30 mg de icatibant Envase con una jeringa prellenada con 3 ml (10 mg/ml),Pieza,Icatibant
010.000.6000.00,Carbonato de calcio/ Vitamina D3. Tableta. Cada tableta contiene: Carbonato de calcio 1666.670 mg equivalente a 600 mg de calcio. Colecalciferol 6.2 mg equivalente a 400 UI de Vitamina D3. Envase con 30 tabletas.,Pieza,Carbonato de calcio/ vitamina d3
010.000.6001.00,Dienogest. Tableta. Cada tableta contiene: Dienogest 2 mg. Envase con 28 tabletas.,Pieza,Dienogest
010.000.6016.00,Ipilimumab. Soluci칩n inyectable. Cada frasco 치mpula contiene: Ipilimumab 50 mg Envase con un frasco 치mpula con 10 ml (50 mg/10 m,Envase,Ipilimumab
010.000.6021.00,Indacaterol/Glicopirronio. C치psula. Cada c치psula contiene: Maleato de Indacaterol equivalente a 110 췃g de indacaterol. Bromuro de Glicopirronio equivalente a 50 췃g. De Glicopirronio. Envase con 30 c치psulas con polvo para inhalaci칩n (no ingeribles) y un dispositivo para inhal,Pieza,Indacaterol/glicopirronio
010.000.6022.00,Macitent치n. Tableta. Cada tableta contiene: Macitent치n 10 mg. Envase con 28 tableta,Pieza,Macitentan
010.000.6024.00,PERTUZUMAB. SOLUCI칍N INYECTABLE. Cada frasco 치mpula contiene: Pertuzumab 420 mg Envase con frasco 치mpula con 14 ,Envase,Pertuzumab
010.000.6028.00,Pralatrexato. Soluci칩n inyectable. Cada frasco 치mpula contiene: Pralatrexato 20 mg Envase con un frasco 치mpula con 1 ,Envase,Pralatrexato
010.000.6035.00,Bromuro de glicopirronio. C치psula con polvo para inhalaci칩n. Cada c치psula contiene: Bromuro de glicopirronio equivalente a 50 췃g de glicopirronio. Envase con 30 c치psulas y dispositivo para inhala,Envase,Bromuro de glicopirronio
010.000.6037.00,Obinutuzumab. Soluci칩n inyectable. Cada frasco 치mpula contiene: Obinutuzumab 1000 mg. Envase con frasco 치mpula con 40 ml (1000 mg/40 m,Envase,Obinutuzumab
010.000.6041.00,Ombitasvir /Paritaprevir / Ritonavir / Dasabuvir. Tableta. Cada tableta contiene: Ombitasvir 12.5 mg. Paritaprevir 75.0 mg. Ritonavir 50.0 mg. Cada tableta contiene: Dasabuvir 250.0 mg Envase con 4 cajas cada una con 7 carteras con 2 tabletas de ombitasvir paritaprevir ritonavir y 2 tabletas de dasabuvir.,Envase,Ombitasvir /paritaprevir / ritonavir / dasabuvir
010.000.6043.00,Asunaprevir. Capsula cada c치psula contiene: Asunaprevir 100 mg envase con 56 c치psula,Envase,Asunaprevir
010.000.6044.00,Daclatasvir. Tableta cada tableta contiene: Daclatasvir Diclorhidrato equivalente a 60 mg de daclatasvir envase con 28 tabletas.,Envase,Daclatasvir
010.000.6045.00,Sofosbuvir. Tableta cada tableta contiene: Sofosbuvir 400 mg envase con 28 tabletas,Envase,Sofosbuvir
010.000.6047.00,Tocilizumab Solucion inyectable cada jeringa prellenada contiene: Tocilizumab 162 mg envase con 4 jeringas prellenadas con 0.9 ml cada una.,Envase,Tocilizumab
010.000.6049.00,Acido Acetilsalicilico Simvastatina Ramipril. capsula cada c치psula contiene: Acido Acetilsalic칤lico 100 mg simvastatina 40 mg ramipril 5 mg envase con 28 c치psul,Envase,Acido acetilsalicilico simvastatina ramipril
010.000.6050.00,Acido Acetilsalicilico SimvastatinaRamipril.Capsula cada c치psula contiene: Acido Acetilsalic칤lico 100 mg simvastatina 40 mg ramipril 10 mg envase con 28 c치psu,Envase,Acido acetilsalicilico simvastatinaramipril
010.000.6052.00,Sofosbuvir Ledipasvir. Tableta cada tableta contiene: Sofosbuvir 400 mg ledipasvir 90 mg envase con 28 tabletas,Envase,Sofosbuvir ledipasvir
010.000.6053.00,Complejo de Protombina Humana. Solucion inyectable cada frasco 치mpula con liofilizado contiene: factor ii de coagulaci칩n humana 280-760 ui factor vii de coagulaci칩n humana 180-480 ui factor ix de coagulaci칩n humana 500 ui factor x de coagulaci칩n humana 360-600 ui prote칤na c 260-620 ui prote칤na s 240-640 ui prote칤nas totales 260-820 mg. envase con un frasco 치mpula con liofilizado frasco 치mpula con 20 ml de diluyente y equipo de admin,Envase,Complejo de protombina humana
010.000.6055.00,Inhibidor de la Esterasa c1 humano. Solucion inyectable cada frasco 치mpula contiene: inhibidor de la esterasa c1 humano 500 ui envase con frasco 치mpula con liofilizado y frasco 치mpula con 10 ml de diluyen,Envase,Inhibidor de la esterasa c1 humano
010.000.6057.00,Gestodeno / Etinilestradiol.Parche cada parche contiene: gestodeno 2.10 mg etinilestradiol 0.55 mg envase con 3 parches.,Envase,Gestodeno / etinilestradiol
010.000.6058.00,Factor VIIIantihemofilico factor de Von Willebrand. solucion inyectable cada frasco 치mpula con liofilizado contiene: factor viii antihemof칤lico humano 500 ui factor de von willebrand 500 ui prote칤na 7.5 mg envase con un frasco 치mpula con liofilizado y un frasco 치mpula con 5 ml de diluy,Envase,Factor viiiantihemofilico factor de von willebrand
010.000.6059.00,Factor VIII Antihemofilico factor de von willebrand. solucion inyectable cada frasco 치mpula con liofilizado contiene: factor viii antihemof칤lico humano 1000 ui factor de von willebrand 1000 ui prote칤na 15 mg envase con un frasco 치mpula con liofilizado y un frasco 치mpula con 10 ml de diluy,Envase,Factor viii antihemofilico factor de von willebrand
010.000.6065.00,Turoctocog alfa (Factor VIII de coagulacion humano de origen adn recombinante) Solucion inyectable cada frasco 치mpula con polvo liofilizado contiene: Turoctocog alfa 2000 UI Envase con un frasco 치mpula con polvo liofilizado una jeringa prellenada con 4 ml de diluyente y equipo para administraci,Envase,Turoctocog alfa (factor viii de coagulacion humano de origen adn recombinante)
010.000.6069.00,Pirfenidona. Tableta de liberacion prolongada. Cada tableta contiene: Pirfenidona 600 mg. Envase con 90 tabletas.,Envase,Pirfenidona
010.000.6070.00,Fibrinogeno humano. solucion inyectable cada frasco 치mpula con polvo liofilizado contiene: fibrin칩geno humano 1.50 g envase con frasco 치mpula con liofilizado y un frasco 치mpula con 100 ml de diluy,Envase,Fibrinogeno humano
010.000.6073.00,Elosulfasa alfa. Solucion inyectable cada frasco 치mpula contiene: Elosulfasa alfa 5 mg envase con un frasco 치mpula con 5 ml (5 mg/5 ml,Envase,Elosulfasa alfa
010.000.6080.00,Secukinumab. Soluci칩n Inyectable Cada pluma precargada contiene: Secukinumab 150 mg Envase con dos plumas precargadas con 1 ml (150 mg/ml),Envase,Secukinumab
010.000.6082.00,MESILATO DE ERIBULINA. SOLUCI칍N INYECTABLE Cada frasco 치mpula contiene: Mesilato de Eribulina 1.130 mg Envase con frasco 치mpula con 1 mg/ 2 mL de soluci,Envase,Mesilato de eribulina
010.000.6085.00,Brentuximab Vedotin. Soluci칩n Inyectable Cada frasco 치mpula con polvo liofilizado contiene: Brentuximab Vedotin 50 mg Envase con un frasco 치mpula con polvo liofiliza,Envase,Brentuximab vedotin
010.000.6086.00,Carfilzomib. Soluci칩n Inyectable. Cada frasco 치mpula con polvo liofilizado contiene: Carfilzomib 60 mg Envase con frasco 치mpula con polvo liofiliza,Envase,Carfilzomib
010.000.6090.00,Emtricitabina/Rilpivirina/Tenofovir Tableta Cada tableta contiene: Emtricitabina 200 mg Clorhidrato de rilpivirina equivalente a 25 mg de rilpivirina Tenofovir disoproxilo fumarato equivalente a 245 mg de tenofovir disoproxilo Envase con 30 tabletas.,Envase,Emtricitabina/rilpivirina/tenofovir
010.000.6091.00,Bromuro De Aclidinio / Formoterol Polvo Para Inhalaci칩n Cada inhalaci칩n contiene: Bromuro de aclidinio equivalente a 340  췃g de aclidinio Fumarato de formoterol dihidratado 11.8  췃g. Cada envase contiene 60 inhalacio,Envase,Bromuro de aclidinio / formoterol
010.000.6092.00,Teriflunomida Tableta Cada tableta contiene: Teriflunomida 14 mg Envase con 28 tabletas.,Envase,Teriflunomida
010.000.6093.00,Ruxolitinib Tableta Cada tableta contiene: Fosfato de ruxolitinib equivalente a 5 mg de ruxolitinib Envase con 60 tabletas.,Envase,Ruxolitinib
010.000.6096.00,BLINATUMOMAB. SOLUCI칍N INYECTABLE Cada frasco 치mpula con polvo liofilizado contiene: Blinatumomab 35 췃g Envase con un frasco 치mpula con polvo liofilizado y un frasco 치mpula con soluci칩n estabilizado,Envase,Blinatumomab
010.000.6097.00,Enzalutamida. C치psula. Cada c치psula contiene: Enzalutamida 40 mg Envase con 120 c치psul,Envase,Enzalutamida
010.000.6098.00,Darunavir / Cobicistat Tableta Cada tableta contiene: Etanolato de darunavir equivalente a 800 mg de darunavir Cobicistat en di칩xido de silicio equivalente a 150 mg de cobicistat Envase con 30 tabletas,Envase,Darunavir / cobicistat
010.000.6108.00,Dolutegravir / Abacavir / Lamivudina. Tableta. Cada tableta contiene: Dolutegravir s칩dico equivalente a 50 mg de dolutegravir Sulfato de abacavir equivalente a 600 mg de abacavir Lamivudina 300 mg Envase con 30 tableta,Envase,Dolutegravir / abacavir / lamivudina
010.000.6115.00,Selegilina. Tableta. Cada tableta contiene: Clorhidrato de selegilina 5 mg. Envase con 20 tabletas.,Envase,Selegilina
010.000.6120.00,Lipegfilgrastim. Soluci칩n Inyectable. Cada jeringa prellenada contiene: Lipegfilgrastim 6mg Envase con 1 jeringa prellenada con 6 mg/0.6 ml (con tapa y sin tapa de seguridad),Envase,Lipegfilgrastim
010.000.6122.00,Amfotericina B Liposomal. Soluci칩n Inyectable. Cada frasco 치mpula con liofilizado contiene: Amfotericina B Liposomal 50 mg. Envase con 1 frasco 치mpula con liofilizado un frasco 치mpula con o sin 12 ml. de diluyente un filtro de 5 mic,Envase,Amfotericina b liposomal
010.000.6123.00,Alogliptina. Tableta Cada tableta contiene: Benzoato de alogliptina equivalente a 25 mg de alogliptina Envase con 28 tabletas,Envase,Alogliptina
010.000.6126.00,Elvitegravir/Cobicistat/Emtricitabina/Tenofovir. Tableta Cada tableta contiene: Elvitegravir 150 mg Cobicistat 150 mg Emtricitabina 200 mg Tenofovir disoproxil fumarato 300 mg equivalente a 245 mg de tenofovir disoproxil Envase con 30 tabletas,Envase,Elvitegravir/cobicistat/emtricitabina/tenofovir
010.000.6127.00,Grazoprevir/Elbasvir. Tableta Hidrato de grazoprevir 102.3 mg equivalente a 100.0 mg de grazoprevir Elbasvir 50.0 mg. Envase con 28 tabletas.,Envase,Grazoprevir/elbasvir
010.000.6131.00,Sofosbuvir Velpatasvir. Tableta Cada tableta contiene: Sofosbuvir 400 mg Velpatasvir 100 mg Envase con 28 tabletas.,Envase,Sofosbuvir velpatasvir
010.000.6132.00,Anfotericina B (Complejo Fosfolipido o Lipidico). Suspensi칩n Inyectable. Cada frasco 치mpula contiene: Anfotericina B (como complejo fosfol칤pido o lip칤dico) 100 mg Envase con un frasco 치mpula con 20 ml (5 mg/mL) con aguja filtro de 5 mi,Pieza,Anfotericina b (complejo fosfolipido o lipidico)
010.000.6133.00,Idarucizumab. Soluci칩n Inyectable. Cada frasco 치mpula contiene: Idarucizumab 2.5 g Envase con 2 frascos 치mpula con 50 mL cada uno (2.5 g/50 m,Pieza,Idarucizumab
010.000.6136.00,Rilpivirina. Tableta. Cada tableta contiene: Clorhidrato de rilpivirina equivalente a 25 mg de Rilpivirina. Envase con 30 tabletas.,Pieza,Rilpivirina
010.000.6151.00,Acido Carglumico. Tableta. Cada tableta contiene: Acido cargl칰mico 200 mg. Envase con 5 tabletas,Pieza,Acido carglumico
010.000.6152.00,Hemina Humana. Soluci칩n Inyectable. Cada ampolleta contiene: Hemina humana 250 mg Envase con 4 ampolletas con 10 ml cada una (250 mg/10 ml),Pieza,Hemina humana
010.000.6153.00,PEMBROLIZUMAB. SOLUCI칍N INYECTABLE Cada frasco 치mpula contiene: Pembrolizumab 100 mg Envase con un frasco 치mpula de 100 mg/ 4 ,Pieza,Pembrolizumab
010.000.6155.00,Beta칤na Anhidra. Polvo Cada gramo contiene: Beta칤na anhidra 1 g. Envase con un frasco con 180 g de polvo con 3 cucharas graduadas de 1g 150 mg y 100 m,Pieza,Betaina anhidra
010.000.6157.00,Beclometasona/Formoterol. Aerosol para inhalaci칩n bucal. Cada gramo contiene: Dipropionato de beclometasona 1.724 mg Fumarato de formoterol dihidratado 0.103 mg Envase con dispositivo inhalador con 120 dosis (100 췃g de Beclometasona y 6 췃g de formoterol/dosis,Pieza,Beclometasona/formoterol
010.000.6161.00,Elvitegravir/Cobicistat/Emtricitabina/Tenofovir Alafenamida. Tableta Cada tableta contiene: Elvitegravir 150 mg Cobicistat 150 mg Emtricitabina 200 mg Tenofovir alafenamida fumarato 11.2 mg equivalente a 10 mg de tenofovir alafenamida Envase con 30 tabletas.,Pieza,Elvitegravir/cobicistat/emtricitabina/tenofovir alafenamida
